id,item_type,split,dataset_name,source_url,windows_0,windows_1,windows_2,windows_3,windows_4
6e3107236300676ff25027faec5976c8,sports_and_outdoors,eval,amazon_sports_and_outdoors,https://cseweb.ucsd.edu/~jmcauley/datasets/amazon_v2/,"{'items': ['Gamo Silent Cat air rifle', 'Crosman Destroyer Pellets.177 Caliber, 4.5mm, 250ct', 'Crosman Destroyer Pellets.177 Caliber, 4.5mm, 250ct', 'BSA Varmint Hunter Precision Laser Sight &amp; Light', 'Gamo 621246054CP Cleaning Set', ' Gamo Tomahawk .177 Cal, 7.8 Grains, Pointed, 750ct ', ' Gamo Tomahawk .177 Cal, 7.8 Grains, Pointed, 750ct ', 'Gamo Air Gun Oil', 'Gamo Air Gun Oil', 'Gamo 632092754 Performance Airgun Pellets Combo Pack 1000 Assorted, .177 Caliber'], 'ratings': [5.0, 5.0, 5.0, 5.0, 3.0, 5.0, 5.0, 5.0, 5.0, 5.0]}","{'items': ['Gamo Rocket .177 Cal, 9.6 Grains, Ballistic Tip, 150ct', ""Hoppe's Boresnake .44, .45 Caliber Pistol and Revolver, Clam E/F"", ' Hammers Telescopic Shooting Tripod w/Pivot V Yoke Max. Height 68&quot; ', 'Moultrie Game Spy L-50', 'Frankford Arsenal Reloading Stand', 'Lyman 49th Edition Reloading Handbook', 'Lyman 7750600 Gen 5 Touch Screen', 'LEE PRECISION 90230 New Auto Prime Hand Priming Tool', 'MTM Ammo Can', 'Plano Protector Single Pistol Case'], 'ratings': [5.0, 5.0, 5.0, 5.0, 4.0, 5.0, 5.0, 5.0, 5.0, 5.0]}","{'items': ['Plano 50-Round Pistol Ammo Box', 'Coleman Camp Oven', 'AIM Mosin Nagant Sling', 'Gorilla Steel Tree Seat HX', '10&quot; Professional Jig With Multi-Monkey Fist Jig', ""Paracord Hero 10' 20' 25' 50' 100' Hanks &amp; 100' 300' Spools Parachute 550 Cord Type III 7 Strand Paracord - Largest Paracord Selection"", 'LEE PRECISION 308 Factory Crimp Die', 'Kleenbore Gun Care Lead Away Patches', 'Edge 52008-6 Code-3 Coyote Locator Siren', 'WindRiver Ultralight Snake Proof Chaps - Saddle Brown -Husky-Medium'], 'ratings': [5.0, 5.0, 5.0, 5.0, 5.0, 5.0, 5.0, 5.0, 2.0, 5.0]}","{'items': [""Hoppe's Boresnake Viper Rifle Bore Cleaner (Choose Your Caliber)"", 'Blackpowder Products Fiberglass Ramrod, 0.50 Caliber', 'Bulldog Cases Extreme Scoped Rifle Case', 'Blackpowder Products Ramrod Accessories Pack, 0.45 Caliber', 'UTG Deluxe Universal Horizontal Shoulder Holster', 'Flextone 8-Loop Call Lanyard, Realtree Max-4', 'CVA AC1631 Qrbp Breech Plug Clean Out System', 'Best Choice Products Tree Stand Climber Climbing Hunting Deer Bow Game Hunt Portable W/Harness', 'Allen Padded Treestand Carry Straps, Mossy Oak Break-Up Country Camo', 'AR500 Steel Targets - Gongs - Silhouettes and More for Pistols and Rifles - Laser Cut USA Steel - 3/16 1/4 3/8 1/2'], 'ratings': [5.0, 5.0, 5.0, 5.0, 5.0, 5.0, 5.0, 4.0, 5.0, 5.0]}","{'items': ['Caldwell Brass Catcher', 'RCBS 9481 Primer Pocket Swager Combo-2', 'Lyman 7832323 Reloading 223 Case Length/Headspace Gauge', 'Lee Precision Quick Trim Die 308 WIN', 'Frankford Arsenal Media Transfer Magnet for Picking up 304 Stainless Steel Media While Reloading', 'Coleman Rest Easy Camp Pad', 'Coleman Rest Easy Camp Pad', ""Uncle Mike's QD Quick Detachable Super Swivel 1391-2 for 1&quot; slings"", 'Allen Eldorado Gun Case, Tan/Realtree Xtra Green', 'Caldwell Steady Rest NXT Adjustable Ambidextrous Rifle Shotgun Pistol Handgun Shooting Rest for Outdoor Range'], 'ratings': [5.0, 5.0, 5.0, 5.0, 5.0, 5.0, 5.0, 5.0, 3.0, 3.0]}"
e9c1f8df8e1b7c0b41f27c13f14cb2f5,sports_and_outdoors,eval,amazon_sports_and_outdoors,https://cseweb.ucsd.edu/~jmcauley/datasets/amazon_v2/,"{'items': ['Schrade SCHF37M Frontier 12.4in Full Tang Stainless Steel Fixed Blade Knife with 7in Drop Point and Micarta Handle for Outdoor Survival, Camping and Bushcraft', 'Silvercell Survival Bracelet With Watch Flint Fire Starter Scraper Whistle Gear (Black)', 'Turtleman TM002-BRK Lightnin Stunt Double Hunter', 'Turtleman Thunder Bowie Camo Sheath,9.25in', ' Timber Rattler Western Outlaw Bowie Knife ', 'GANZO G801 Hunting Survival Knife Tactical Fixed Blade Sharpener &amp; Fire Starter 440 Stainless Steel Partially Serrated', 'Schrade SCHF36 Frontier 10.4in Stainless Steel Full Tang Fixed Blade Knife with 5in Drop Point and TPE Handle for Outdoor Survival, Camping and Bushcraft', 'Schrade SCHF59 8.4in High Carbon Steel Fixed Blade Knife with 3.8in Drop Point Blade and G-10 Handle for Outdoor Survival, Camping and EDC', 'Morakniv Craftline Robust Trade Knife with Carbon Steel Blade and Combi Sheath, 3.6-Inch', 'SALE Full Tang Survival Neck Knife &amp; Fire Starter HK762BK'], 'ratings': [5.0, 5.0, 5.0, 5.0, 5.0, 5.0, 3.0, 5.0, 3.0, 2.0]}","{'items': ['Gerber Bear Grylls Ultimate Pro Knife, Fine Edge [31-001901]', 'bayite 1/2 x 6 Inch Survival Drilled Flint Steel Fire Starter Ferrocerium Rod Kit with Striker-Pro Striker Paracord Landyard Handle Large', 'Timber Rattler Big Green Bowie Knife', 'Bear Grylls Folding Sheath Knife &amp; Multi-Tool Gerber Survival Gear', 'Schrade SCHF45 Leroy 16.5in High Carbon S.S. Full Tang Fixed Blade Knife with 10.4in Bowie Blade and TPE Handle for Outdoor Survival Camping and EDC', 'Xentyx Survival Gear, Carabiner Multitool Clip in Outdoor Camping, Hunting, Tactical Military Equipment, Multi Tool Locking Knife, Heavy Duty Pocket Blade, Black', 'Schrade SCHF51 Frontier 10.9in Steel Full Tang Fixed Blade Knife with 5.1in Drop Point Blade and TPE Handle for Outdoor Survival, Camping and EDC', 'WRT Outdoor Survival Paracord Bracelet with Compass, Flint/Steel, and Whistle.', 'HotPod USB Rechargeable Pocket Hand Warmer with Sleeve (Blue)', 'PARACORD PLANET 1/8 Inch Shock Cord in Choose from 10, 25, 50, and 100 Feet, Made in USA'], 'ratings': [5.0, 5.0, 3.0, 3.0, 3.0, 4.0, 3.0, 4.0, 3.0, 5.0]}","{'items': ['aminco Carolina Panthers NFL Sports Team Logo Swirl Heart Shape French Hook Style Charm Dangle Earring Set Multi', 'Cold Steel CS80PH-BRK Survival Edge', 'Schrade SCAXE10 11.1in Full Tang Hatchet with 3.6in Stainless Steel Blade and TPR Handle for Outdoor Survival Camping and Everyday Carry', 'Ontario Knife 7025 Ontario Old Hickory 7&quot; Butcher Knife Wood Handle, 7-1/4 in x 11.81 in L, Brown', 'CFK Cutlery Company USA Handcrafted LEFT HAND SCOUT / RIGHT HAND CROSS DRAW Custom BROWN Leather Tactical Hunter Tracker Horizontal Knife Sheath with Wet Stone &amp; Fire Starter Set CFK119 NEW DESIGN', 'CFK Cutlery Company USA Handmade BLACK Leather Horizontal-Vertical Sheath Bushcraft Tactical Blade Knife with Sharpening Stone &amp; Fire Starter Rod Set CFK300', 'Condor Tool and Knife Mini Bushlore 3-Inch Drop Point Blade, Walnut Handle, Leather Sheath', 'Gerber 31-002947 Bear Grylls Survival Series, Folding Sheath Knife, Black Fine Edge Drop Point Knife', '2010180 Cold Steel Survival Edge Black, 80PHZ', 'Paracord Belt - Survival Belt with Metal Buckle, Adjustable, Fits Most Men &amp; Women Waist, Outdoor Gear Kit for Camping, Hiking, Fishing, Sports Exercise, Casual Formal Design, 250LB Paracord - Black'], 'ratings': [4.0, 5.0, 4.0, 5.0, 5.0, 5.0, 5.0, 5.0, 5.0, 5.0]}","{'items': ['Emarth Magnesium Fire Starter Flint - Emergency Survival Kit with Compass', 'Cold Steel Bowie Bushman Fixed Blade Knife Dagger', 'MOSSY OAK 14-inch Bowie Knife Stainless Steel Fixed Blade Full Tang Handle with Leather Sheath', 'MOSSY OAK Survival Knife 10-inch Fixed Blade Hunting Bowie Knife with Sharpener and Fire Starter', 'Gerber Bear Grylls Ultimate Knife, Fine Edge [31-001063]', 'CONDOR Tactical Cap', 'Orca Tactical MOLLE EMT Medical First Aid IFAK Utility Pouch (Bag Only)', ""'47 NFL Big Buck Realtree Clean Up Camo Adjustable Hat"", 'Schrade SCHF27 11.5in Stainless Steel Full Tang Fixed Blade Knife and Tool with 6.6in Drop Point Blade and TPE Handle for Outdoor Survival, Camping and Bushcraft', 'UST Folder 2.5/3.5 Folding Knife'], 'ratings': [5.0, 5.0, 5.0, 1.0, 5.0, 5.0, 5.0, 5.0, 3.0, 3.0]}","{'items': ['UST Field Saw , Folding Blade', 'KA-BAR BK39 Becker Clear Coat Combat Bowie Knife, Black', 'UEB Outdoor Survival Cigar Starter Kit/ Outdoor Camping Solar Spark Lighter,Emergency Cigar Starter', 'Morakniv Companion Heavy Duty Knife with Sandvik Carbon Steel Blade, 0.125/4.1-Inch', 'KA-BAR 1118BP Skeleton Knife', 'Victorinox Pocket Knife Folding Pioneer X Multitool Silver Alox', 'Condor Tool and Knife Elegan 2 3/32-Inch Neck Knife, Kydex Sheath with Ball Chain', 'Gerber StrongArm 420 High Carbon Stainless Steel Fixed Blade Survival Tactical Knife with Molle Compatible Multi-Mount Sheath - Serrated Edge - Coyote Brown (30-001059)', 'Schrade SCAXE2L 15.7in Large Survival Axe with 4.2in Stainless Steel Blade and Glass Fiber PA and TPR Rubber Handle for Outdoor Survival Camping and Everyday Tasks', 'YSTD&reg; 1/5/10/20pcs Side Release Whistle Buckle Escaper Flint Fire Starter For Paracord Bracelet'], 'ratings': [4.0, 5.0, 5.0, 5.0, 4.0, 5.0, 5.0, 4.0, 5.0, 4.0]}"
57b36b34cc6650b076b2212da745248e,sports_and_outdoors,eval,amazon_sports_and_outdoors,https://cseweb.ucsd.edu/~jmcauley/datasets/amazon_v2/,"{'items': ['Yaktrax Pro Traction Cleats for Snow and Ice', 'Energizer Carabiner LED Area Tent Light', 'SPRI Step360 Pro Trainer', 'HeartMath Inner Balance 30-Pin', 'HD Combo Pack Night Vision and Day Vision + Visor Clip', 'Harbinger Padded Cotton Lifting Straps with NeoTek Cushioned Wrist (Pair)', 'Harbinger Padded Cotton Lifting Straps with NeoTek Cushioned Wrist (Pair)', ""SKLZ Kool 'N Fit Sport Performance Spray"", 'Critical Cycles Classic Commuter Bike and Skate Helmet', ""The Professional's Choice Cotton Flannel Gun Cleaning Patches, Bulk - Large Bag""], 'ratings': [4.0, 4.0, 3.0, 4.0, 4.0, 4.0, 4.0, 3.0, 4.0, 5.0]}","{'items': ['SABRE RED Pepper Spray - Police Strength - Spitfire- Most Advanced, Compact &amp; Fastest-Deploying Key Ring Spray with Refillable Case', 'Skulpt Aim Measures Body Fat Percentage and Muscle Quality', 'Kelty Salida Camping and Backpacking Tent', ""FoodSaver 11&quot; x 12' Heavy-Duty Puncture Resistant Rolls, 2-Pack"", 'Zepp Tennis Swing Analyzer', 'Slumberjack Boundary 40 Degree Reg Rh', 'WWE Create A Superstar John Cena Figure Pack', 'Wordlock MatchKey Cable Lock', 'Franklin Sports Spyderball', 'IFITBELT&reg; Running Belt [2 PACK] Water Resistant Waist Pack Sport Belt With Wide Expandable Storage Pocket/ Reflective Strip Fits Most Smartphone Include iPhone6 plus For Fitness Cycling Hiking Running'], 'ratings': [5.0, 4.0, 4.0, 5.0, 4.0, 4.0, 4.0, 4.0, 3.0, 5.0]}","{'items': ['Triumph Tournament Bean Bag Toss Game with 2 Easy Transport Game Platforms with Scratch Resistant Surface, Convenient Carry Handle and 8 Toss Bags', 'Shark Ears Premium Long Hair SoSoft Silicone Swim Cap for Men Women and Child Swimmers - SwimCap with Ear Pockets and FREE Medical Grade Silicone Ear Plugs - 1 size', 'Gaiam Fitness Mat with Carrying Strap', ""Tommie Copper Men's Core Band"", 'SPRI Power Push Up Stand', 'WAAO Hand Grip Strengthener Workout, Hand Exerciser, Strength Trainer, Adjustable Resistance Range 22-88 Lbs, Non-slip Gripper, Great for Athletes Pianists Kids &amp; Hand Rehabilitation Exercising', 'Resistance Bands Workout Exercise Bands Premium Rubber Bands Colors No Smelly Plastieic Smell Perfect for Pull-ups, Chin Ups, Muscle Ups, Ring Dips, Home Gym', 'Mountain House Chicken and Dumplings with Vegetables', 'Contigo Purity Glass Water Bottle, 20 oz, Scuba With Silicone Tether', 'Contigo Purity Glass Water Bottle, 20oz, Smoke'], 'ratings': [3.0, 4.0, 5.0, 2.0, 4.0, 5.0, 5.0, 4.0, 5.0, 5.0]}","{'items': ['Soccer Strong 9 Week Performance Soccer Training Program and Soccer Training Kit', 'Baseball Strong 9 Week Performance Baseball  Training Program and Baseball Training Kit', 'Golf Strong 6 Week Performance Golf Training Program and Golf Training Kit', 'FRONTIERSMAN Practice Bear Spray &ndash; Water-Based Training Canister &ndash; 30&rsquo; Range (7.9 oz) &ndash;INERT - NO Active Ingredients', 'Gaiam Yoga Sand Bag, Navy', 'Franklin Sports MLB Industrial Grade Batting Tee - Heavy Duty Batting Tees for Baseball - Tee Ball Stand and Softball Hitting Tee - Adjustable Batting Tee for Youth - Durable Rubber Baseball Practice', 'Merrithew Fitness Circle Flex', 'Coleman Carlsbad Tent with Screen Room', 'FILA Accessories Neoprene Hand Weight', 'SABRE Runner Personal Alarm - 130dB (1,000 Feet/300M Range) with Adjustable/Reflective/Weather-Resistant Wrist Strap for Walking &amp; Running Outdoors'], 'ratings': [4.0, 4.0, 4.0, 3.0, 4.0, 4.0, 4.0, 4.0, 5.0, 5.0]}","{'items': ['Franklin Sports Hockey Goal - NHL - Steel - 72 x 48 Inch - 1.5 Inch Tubing', 'Franklin Sports Mini Hockey Goal Set with Target - NHL - Tuukka Rask', 'adidas Lifting Straps', 'CAP Barbell Flat Weight Bench, Black', 'Franklin Sports Pickleball Balls', 'Mio FUSE + PEAR Fitness Bundle', ""Women's Core Compression MicroModal Over The Calf Socks"", 'SPRI Exercise Dice', ""Tommie Copper Men's Dress Micro Modal Over The Calf Socks"", 'SPRI Performance Sprint SAK Trainer'], 'ratings': [4.0, 3.0, 3.0, 4.0, 4.0, 3.0, 4.0, 3.0, 4.0, 5.0]}"
b492fc10c331d9639ff78a2c3da0ffbf,sports_and_outdoors,eval,amazon_sports_and_outdoors,https://cseweb.ucsd.edu/~jmcauley/datasets/amazon_v2/,"{'items': [""Fusion 1.50-Inch Shooter's Belt without Loop and Raptor-Alum Buckle"", 'Zoom Z Hog Bait-Pack of 8', 'P-Line Floroclear Mist Green Fishing (Filler Spool)', 'BLACKHAWK! Black Shotgun Case, 43-Inch', 'Rothco P/C BDU Shorts', 'Rothco P/C BDU Shorts', 'Rothco P/C BDU Shorts', '5.11 Tactical Point Sling', 'Rothco P/C BDU Shorts', 'CONDOR Tactical Single M4 Mag Pouch'], 'ratings': [5.0, 5.0, 5.0, 5.0, 5.0, 5.0, 5.0, 5.0, 5.0, 5.0]}","{'items': ['Boker Magnum 02YA147 Urban King Fixed Blade Knife with 4 3/4 in. 440 Stainless Steel Blade, Black', 'Condor Tactical Double Pistol Mag Pouch', 'Rothco Longer Style BDU Shorts', 'Stanley E-BB38-217 Buzzbait 3/8oz', 'SpecOps SO100320401 T.H.E. Phone Holster, Large', 'VooDoo Tactical 15-0156 36-inch Enhanced Short Drag Bag w/Shoulder Harness', 'Magpul QD Quick-Disconnect Sling Swivel', 'SnugPak Jungle Right Hand Zip Bag, Black', 'Troy Industries Front HK Folding Battle Sight (Black)', 'Troy Industries Folding Battle Sight Rear'], 'ratings': [5.0, 5.0, 5.0, 5.0, 5.0, 5.0, 5.0, 5.0, 5.0, 5.0]}","{'items': ['Zoom Bait Horny Toad Bait-Pack of 5', ""Berkley GJFN12-BF Bass Gripper Ike's Finesse Jig, Blue Fleck, 1/2-Ounce"", 'Akuna Buzzin Bomb 3/8-Ounce Buzzbaits', 'Maxpedition Gear 3 x 5-Inch Notebook Cover', 'Generation 4 Sure Plug for Glock 17, 19, 22, 23, 31, 32, 34, and 35', 'GRANDE 5-Inch Flash Real Shad Bait Lure', 'Condor Tech Sheath - Black', 'Boker Plus Tek-Lok Adapter', 'Boker Plus Tek-Lok Adapter', 'GustBuster 68 Inch Canopy Doorman Umbrella, Black'], 'ratings': [5.0, 5.0, 5.0, 5.0, 5.0, 5.0, 5.0, 5.0, 5.0, 5.0]}","{'items': ['Suunto Wrist-Top Computer Watch Replacement Battery Kit with plastic cover(Vector, Advizor, X-Lander, S-Lander, Altimax, Yachtsman, Mariner, Regatta)', 'Pro Ears - Pro Tac Mag Gold - Military Grade Electronic Hearing Protection and Amplification - NRR 30 - Range Ear Muffs', '5.11 Tactical Range Bag', '&quot;A Positive&quot; Blood Type Molle System Ready Key Chain (Black)', 'Browning Backlash Knife, Black', 'SureFire X300 Ultra Series LED WeaponLights with TIR Lens', 'Berkley Havoc Bottom Hopper Bait', 'Buckeye Spot Remover Pro-Model 1/4oz Black', 'Berkley Gulp! 3&quot; Craw Color: Black Emerald (BEM)', 'Eagle Claw Trokar Light Wire Finesse Worm Hook'], 'ratings': [5.0, 5.0, 5.0, 5.0, 5.0, 5.0, 5.0, 5.0, 5.0, 5.0]}","{'items': ['Daiwa AIRD701MLXB Casting Rod (7- Feet, Medium Light, 1 Piece, 6-15 Pounds)', ""Daiwa Crossfire Casting Rod 7' Medium Act 1 pc CFE701MFB"", 'SHIMANO SELLUS RODS - Casting, Graphite Freshwater Casting Fishing Rod', 'OneTigris Tactical Molle Shoulder Triple Magazine Pouch Crossbody Sling Bag Messenger Bag', 'Damiki D-Pop 70 Topwater Popper', 'Gambler Lures Twin Tail Craw Grub Fishing Jig - Pack of 10 (White Lightening, 3-Inch)', 'Strike King Junior KVD Splash Hardbait Series Bait', 'Stren FluoroCast', 'Yo-Zuri Sashimi Popper Floating Lure, Chameleon Black Chartreuse, 3-Inch', 'Daiwa AIRD100HS Aird Low Profile Baitcast High Speed Reel'], 'ratings': [5.0, 5.0, 3.0, 5.0, 5.0, 5.0, 3.0, 5.0, 5.0, 5.0]}"
3c2e9041bc5f9f51d76a81d390b93944,sports_and_outdoors,eval,amazon_sports_and_outdoors,https://cseweb.ucsd.edu/~jmcauley/datasets/amazon_v2/,"{'items': ['Black Roll of 25 Crown Wheatear Clay Poker Chips', 'MOLLE II Standard Pack, Desert Camo, Genuine U.S. Military Issue', 'MTM Ammo Can', 'Mora Bushcraft Triflex Carbon Steel Knife', ""Hoppe's BoreSnake Pistol and Revolver Bore Cleaner (Choose Your Caliber)"", 'Esbit 1300-Degree Smokeless Solid Fuel Tablets for Hobby, Outdoor, and Emergency Use, 20 Pieces Each 4g', 'Maxpedition Double Sheath', '3 Bug Slipit Set SS Plain Edge', 'Pachmayr 5166 Tactical Grip Glove for S&amp;W Sigma, SD9VE, SD40VE, Walther P99, Taurus 24/7 (Full size)', 'Osprey Hydraform Reservoir Cleaning Kit'], 'ratings': [4.0, 5.0, 4.0, 5.0, 5.0, 5.0, 5.0, 4.0, 5.0, 5.0]}","{'items': ['SealLine Electronic Case', ""Black Crystal Hiking Ski Snow Gaiters Waterproof Breathable Nylon Men's Black Size Large"", 'Giro Feature Mountain Bike Helmet', 'Topeak D2 SmartGauge', 'Polar Insulated Water Bottle Solid Red 24oz', 'Planet Bike Aluminum water bottle cage', ""Oakley Men's Factory Bike Glove"", 'Topeak Peakini II Mini Pump', 'SHIMANO PD-M324 Clipless/Clip Pedals', ' Camelbak Rain Cover M.U.L.E. '], 'ratings': [5.0, 1.0, 5.0, 5.0, 5.0, 5.0, 5.0, 5.0, 5.0, 5.0]}","{'items': [""Planet Bike Men's A.R.S. Anatomic Relief Bicycle Saddle"", 'White Lightning Epic Ride All Conditions Light Bicycle', 'Topeak 60102538 Hexus II Multi-tool', 'Maxxis Ardent Mountain Bike Tire', 'IceToolz Cassette Lockring Tool with PIN', 'Portland Design Works Danger Zone Tail Light', 'Planet Bike Blinky Safety bike light set', 'Avenir Chain Whip', 'Avenir Chain Whip', 'VELO Chain Stay Protector'], 'ratings': [3.0, 4.0, 2.0, 5.0, 5.0, 5.0, 5.0, 4.0, 4.0, 4.0]}","{'items': ['S.O.L. Survive Outdoors Longer Slim Rescue Howler Whistle (2-Count)', ""adidas Men's 3 Stripe Pant"", 'TETON Sports Celsius XXL Sleeping Bag; Great for Family Camping; Free Compression Sack', 'Optimus Terra Weekend HE .95L Pot', 'NYKKOLA 4-Pack Extra Large Emergency Mylar Blanket 84&quot; X 52&quot; -Gold/Silver Space Blanket: Designed for NASA - Essentials for Outdoors, Hiking, Survival, Marathons or First Aid', ""Freedom Isn't Free Wristband"", 'Pow Mia Not Forgotten Black Wristband', 'Light my Fire Titanium Spork', 'IceBeans uiphgjwexzv', 'Pearl Izumi Impact Glove'], 'ratings': [5.0, 3.0, 4.0, 5.0, 5.0, 5.0, 5.0, 4.0, 5.0, 1.0]}","{'items': ['Avid Speed Dial 7levers', ""adidas Men's Basic 3-Stripe Short"", 'Avid BB7 MTN G2 Front or Rear Rotor', 'Jagwire Ripcord DIY Brake Kit', 'Hollywood Racks T970 Fork Block 1 Bicycle Fork Mount', 'GORE BIKE WEAR Ozon Arm Warmers', 'Thomson Elite Bicycle Seatpost', 'Park Tool Master Link Pliers', 'Thomson Elite Bicycle Seatpost', 'Thomson Elite Bicycle Seatpost'], 'ratings': [5.0, 3.0, 5.0, 5.0, 5.0, 5.0, 4.0, 5.0, 4.0, 4.0]}"
41b145b0d35fdfe7a3b7d07ea52c3aa2,sports_and_outdoors,eval,amazon_sports_and_outdoors,https://cseweb.ucsd.edu/~jmcauley/datasets/amazon_v2/,"{'items': ['Bike Tube 700x25-28C Recycle Butyl Solid Brass Stem Valve Presta, 1 Pc Pack, 2 Pcs Pack, 4 Pcs Packs For Choice', 'SHIMANO BL-1055 Aero Hood Covers (Road)', 'Conquer Portable Home Bike Repair Stand Adjustable Height Bicycle Stand', ' Sugino 48t 130mm Outer Chainring ', 'Park Tool Compact Crank Puller', ' XLC Freewheel Cog Remover Tool ', 'Portland Design Works Shiny Object CO2 Inflator Head', 'FOCO NFL Unisex Sock Monkey Hat', 'Park Tool Folding Chain Tool - CT-6.2', 'Zicome Black Bicycle Handlebar Tape with End Plugs, 1 Pair(2 Rolls)'], 'ratings': [5.0, 5.0, 5.0, 5.0, 5.0, 4.0, 5.0, 5.0, 5.0, 5.0]}","{'items': ['LED Concepts Super Bright Safety Bicycle Light Front and Back Set Red and White Light &ndash; No Tools Needed &ndash; Batteries Included', 'Venzo 1/4&quot; 2-10NM Bike Bicycle Portable Torque Wrench', 'Xtreme Bright X-96 USB Rechargeable LED Bike Taillight - 650mAh Battery (USB Cable Incl.), 4 Light Modes', 'Continental 42mm Presta Valve Tube, Black, 700 x 20-25c', 'FSA Omega Compact Road Handlebar', 'Sunlite Long Cage 7spd Rear Derailleur', 'SunRace SLR 80 8 Speed Clamp-On Shifters 28.6mm Clamp Size', 'Continental Ultra Sport II Bike Tire', 'Sunlite SL55 Sealed Bottom Bracket Set, 68 x 107mm, English', 'Puma Borussia Dortmund Away 2015 Jersey 11 Reus (Medium)'], 'ratings': [2.0, 5.0, 5.0, 2.0, 5.0, 5.0, 5.0, 4.0, 5.0, 5.0]}","{'items': ['SHIMANO Hollowtech-II crank-arm/cap tool, TL-FC16', '4ZA Stratos Alloy Seatpost', 'Continental Tour Ride Urban Bicycle Tire', 'Park Tool Freewheel Remover: Sun Tour 2 Notch', 'Mighty Pro Spacer, Black, 10-15mm', 'Roswheel Outdoor Cycling Bike Bicycle Saddle Bag Under Seat Packs Tail Pouch - Blue', 'Continental Tour Ride Urban Bicycle Tire', 'Park Tool Freewheel Remover: Sun Tour 2 Notch', 'Diamondback 700x20/25 48mm Smooth Presta Valve Bicycle Tube, Black', 'Ibera Bicycle Triangle Frame Bag, Bike Top Tube Cycling Corner Pouch'], 'ratings': [5.0, 4.0, 4.0, 5.0, 4.0, 5.0, 4.0, 5.0, 5.0, 5.0]}","{'items': ['Voberry New Bike Bicycle Red LED Rear Light 3 modes Waterproof Tail Lamp Quick Release', 'Shimano Tourney A070 2 x 7-Speed STI Lever Set', ""ONGUARD 8021 Mastiff 6' x 3/8&quot; Quad Chain Lock"", 'Park Tool BBT-19.2 Bottom Bracket Tool', 'Origin8 MaxFit Front Derailleur Clamp Band/Adapter', 'Aliceclub Multi-function Portable Bike Bicycle Repair Tools Kit Triangle Bag with Tire Levers, Chain rivet Extractor, Bicycle Pouch Pump - Black', ""Cyclists' Choice Tranz-X Time Trial Bullhorn Handlebar 31.8mm Clamp Black Alloy Fixed Gear 40cm"", 'IceToolz Cassette Lockring Tool with PIN', ""neff Men's Daily Stripe Beanie"", 'Shimano Tiagra CS-4600 10-Speed Cassette - 12X30T'], 'ratings': [2.0, 5.0, 5.0, 3.0, 5.0, 5.0, 5.0, 5.0, 5.0, 5.0]}","{'items': ['SHIMANO Universal 1.6 Brake Wire (10/Box)', 'Park Tool 16-Notch Bottom Bracket Tool', 'SHIMANO Zinc Shift Cable Box of 10 (1.2x2100mm)', 'SHIMANO Road Bicycle Shift Cable Set - OT-SP40', 'DULEX CREE Q5 LED Flashlight Torch Bike Headlight With 360&deg;Rotation Flashlight Mount Holder', 'WOTOW 11 in 1 Bicycle Folding Tool Set Multifunction Repair Kit Allen Wrench Chain Cutter Tire Lever', 'Ibera Bicycle Bag PakRak Clip-On Quick-Release All Weather Bike Panniers (Pair), Includes Rain Cover', 'Bluecell Road Bicycle Bar Tape Handlebar Bar Tape Cork (Red)', 'SY1051-BRK Hi-Slip Grease Jar - Synthetic', ' SHIMANO SIS Gear Housing Cable (4mm X 10 m, Black) '], 'ratings': [5.0, 5.0, 5.0, 5.0, 4.0, 5.0, 5.0, 4.0, 5.0, 5.0]}"
