id,item_type,split,dataset_name,source_url,windows_0,windows_1,windows_2,windows_3,windows_4
bca90eca5cb2f26334a09bc31402c96f,sports_and_outdoors,eval,amazon_sports_and_outdoors,https://cseweb.ucsd.edu/~jmcauley/datasets/amazon_v2/,"{'items': ['Pilates Mini-Ball Advanced Workout DVD with Leslee Bender', 'Sarah Peyton Home 3-Piece Flameless Candle Set', 'SKLZ Quickster Lacrosse Goal - Portable Practice Net', ""SKLZ Goal-EE - 4' x 3' Portable Soccer Goal"", 'SKLZ Agility Cone Set 20pk', 'Prorack 2-Bike Hitch Carrier', 'Allen Sports Premier Trunk Mounted Bike Rack', 'Thorlos TRMX Trail Running Ankle Sock', 'Contigo Jackson Reusable Water Bottle, 24oz, Lilac', 'SKLZ Golf Trainer Ball - Self-Guided Stability Ball'], 'ratings': [4.0, 5.0, 5.0, 4.0, 5.0, 4.0, 5.0, 5.0, 4.0, 5.0]}","{'items': ['The Firm Zip Trainer Medicine Ball Kit', 'SKLZ Quickster 8x5 foot Soccer Combo System (One Goal and One Rebounder)', ""Saucony Women's Bullet Capri"", 'SKLZ HD Foam Roller &ndash; EPP High-Density Massage Roller', 'Saris The Boss Single Bike Storage, White', 'SKLZ Ladders', 'Diamondback Overdrive Mountain Clipless Pedals, Black/Silver', 'EastPoint Sports Bean Bag Toss Washer Toss Set with Molded Case', 'Combat Sports Curved Kickboxing Muay Thai MMA Training Kick Punch Strike Shield Thai Pad Kick Shield', 'Franklin Sports MLB CFX Pro Signature Series Batting Gloves (Cabrera/Cano/Ortiz)'], 'ratings': [5.0, 5.0, 5.0, 5.0, 5.0, 5.0, 5.0, 5.0, 5.0, 5.0]}","{'items': ['MERRITHEW Eco Yoga Mat (TPE) (Maroon/Charcoal), 0.125 inch / 3 mm', ""Gaiam Women's Petal Back Top"", ""Gaiam Women's Petal Mesh Tank with Bra"", 'Contender Fight Sports Competition Boxing Headgear without Cheeks', 'Bestway Trophy Runner 2 Person Inflatable Boat', 'Alexapure Survival Spring Field-Ready Water Filter in King&rsquo;s Camo Shadow Pattern', 'SPRI Interchangeable Jump Rope', 'CamelBak Eddy 20oz Vacuum Insulated Stainless Water Bottle', 'FRONTIERSMAN Practice Bear Spray &ndash; Water-Based Training Canister &ndash; 30&rsquo; Range (7.9 oz) &ndash;INERT - NO Active Ingredients', 'Critical Cycles Classic Commuter Bike/Skate/Multi-Sport CM-2 Helmet with 10 Vents'], 'ratings': [5.0, 4.0, 4.0, 5.0, 5.0, 5.0, 5.0, 5.0, 5.0, 4.0]}","{'items': ['Finis Edge Fins', ""Burton Men's Weekender Socks (2 Pack)"", 'Franklin Sports NHL Mini Player Helmet', 'Franklin Sports Kong-Air Sports Boxing Gloves', 'Ringside Wood Beam Heavy Bag Hanger, One Size', 'SPRI Exercise Dice', 'Burton Unisex Honey-Baked Hammock', 'Jef World of Golf Gifts and Gallery, Inc. Golf Practice Balls (42 Multi-Colored Balls)', 'Franklin Sports Quikset Badminton', 'Franklin Sports Hockey Shooting Targets - NHL - 4 Knock Out Targets with Goal Attachments'], 'ratings': [5.0, 4.0, 3.0, 5.0, 5.0, 5.0, 4.0, 4.0, 4.0, 5.0]}","{'items': ['Franklin Sports NHL SX Pro 54 in. Innernet PVC Goal', 'Babiators Submariners Swim Goggles', 'Franklin Sports Tuukka Rask Street Hockey Goalie Stick', 'Ringside Synthetic Bag Gloves', ""SKINS Mens DNAmic Men's Compression Short sleeve Top"", 'Franklin Sports Official Size Basketball - Batman or Superman', 'Fitlosophy Fitspiration 16 Week Fitness and Gratitude Journal, 8&quot; W x 6.5&quot; L', 'Franklin Sports Quikset Anywhere Basketball', 'Franklin Sports Blackhawk Soccer Ball', 'Zycom Zing 3 Wheel Adjustable Mini Kick Scooter with T-Bar'], 'ratings': [5.0, 5.0, 5.0, 4.0, 3.0, 5.0, 5.0, 5.0, 5.0, 5.0]}"
d693bccb544c6a99b056bd905c112c8f,sports_and_outdoors,eval,amazon_sports_and_outdoors,https://cseweb.ucsd.edu/~jmcauley/datasets/amazon_v2/,"{'items': ['Timbuk2 Originals Classic Messenger Bag', 'Nite Ize SlapLit LED Bracelet', 'Women Men Dark Red Cycling Bicycle Bike Raincoat Rain Cape', ""Columbia Men's Silver Ridge Multi Plaid Short Sleeve Shirt"", ""Columbia Men's Silver Ridge Multi Plaid Short Sleeve Shirt"", 'Ritchey Pro Road Bike Stem, Black, 60mm', 'Sightmark Sure Shot Reflex Sight', 'Sightmark Sure Shot Reflex Sight', 'NcSTAR Red Dot Sight TACTICAL RED DOT WITH 4 DIFFERENT RETICLES/BLACK', 'Browning Buckmark Reflex Sight'], 'ratings': [5.0, 5.0, 5.0, 5.0, 5.0, 4.0, 5.0, 5.0, 5.0, 5.0]}","{'items': ['BESTSUN USB Rechargeable Bike Light Set, Smart Bicycle Headlight, Bike Front Lights Back Safety Flashlight, Bicycle Lights, IP65 Waterproof, with Free Tail Light for Kids Men Women Road Cycling', 'Global Sportsman Tactical Combat Military Four 4 Separate Reticle 7 Brightness Settings Red Dot Tubeless Open Reflex Design Sight with Weaver-Picatinny Rail Base Mount', 'Aim Sports Red Dot Sight with 4 Different Reticles', ""IRON JIA'S Tactical Holographic Reflex Red Green Dot Sight 4 Type Reticle for 20mm Rails Airsoft Hunting"", 'Leegoal Bicycle Bike Flashlight LED Torch Mount Holder 360&deg; rotation Cycling Clip Clamp', 'Set of (6) 3&quot; AR500 Steel Gong Shooting Target 3/8 Single Hole From Bullseye Metals', '(3) IPSC &quot;Mini&quot; Steel Shooting Target 3/8&quot; AR500 From Bullseye Metals', '(5) 8&quot; AR500 Steel Gong Shooting Target 3/8 One Hole. From Bullseye Metals', '8&quot; AR500 Steel Gong Shooting Target 3/8&quot; With one hole. From Bullseye Metals', '6&quot; AR500 Steel Gong Shooting Target 3/8&quot; With one hole. From Bullseye Metals'], 'ratings': [5.0, 5.0, 5.0, 5.0, 5.0, 5.0, 5.0, 5.0, 5.0, 5.0]}","{'items': ['7&quot; AR500 Steel Gong Shooting Target 3/8&quot; With one hole. From Bullseye Metals', '(4) 6&quot; AR500 Steel Gong Shooting Target 3/8&quot; With two holes. from Bullseye Metals', '(6) 7&quot; AR500 Steel Gong Shooting Target 3/8&quot; With two holes. From Bullseye Metals', '3/8 AR500 8&quot; 7&quot; 6&quot; DIAMETER STEEL GONG TARGET SET. From Bullseye Metals', '(4) 5&quot; AR500 Steel Gong Shooting Target 3/8 Single Hole. From Bullseye Metals', 'AR500 5&quot; 4&quot; 3&quot; DIAMETER STEEL GONG TARGET SET. From Bullseye Metals', 'AcuRite 02020 Portable Lightning Detector', 'ECEEN Hiking Backpack, 7 Walls Solar Panel Charge for Smart Cell Phones and Tablets, GPS, eReaders, Bluetooth Speakers, Gopro Cameras', 'Eceen&reg; Hydration Pack/Hydration backpack+Solar Charger Bag/Solar Panel Bag/Solar backpack charger for cycling riding iphone 6 iphone 6 plus and other smart phones', 'SMC Snow Picket'], 'ratings': [5.0, 5.0, 5.0, 5.0, 5.0, 5.0, 5.0, 5.0, 5.0, 5.0]}","{'items': ['Serfas TCPG Bicycle Floor Pump', 'Scrubba Wash Bag - Portable Laundry System for Camping, Hiking, Backpacking and Travel', 'Vont Bike Light - Tools-Free Installation in Seconds - Headlight Compatible with: Mountain &amp; Kids &amp; Street Bicycles', 'Peak Design Capture PRO Camera Clip with DUAL Plate', 'Peak Design Capture PRO Camera Clip with ARCA Plate', '2015 Latest Version! Ultra-Bright High Power CREE LED Headlamp Flashlight Torch with 2000mAh Lithium Rechargeable Battery--- 297% Longer Battery Life! Adjustable White, Red, and Strobe Light Ideal for Camping, Running, Hunting, Reading, Fishing and Other Outdoor Activities ---Lifetime Guarantee!!!', '2015 Latest Version! Ultra-Bright High Power CREE LED Headlamp Flashlight Torch with 2000mAh Lithium Rechargeable Battery--- 297% Longer Battery Life! Adjustable White, Red, and Strobe Light Ideal for Camping, Running, Hunting, Reading, Fishing and Other Outdoor Activities ---Lifetime Guarantee!!!', 'Bambu Dru Lightweight Compact Disposable Bamboo Sport Towel for Backpacking, Camping, Beach, Gym, Swimming, all Sports - Super Absorbent, Antibacterial and Eco Friendly! - Quick-drying and Super Soft - Bath-sized, 27&quot; x 55&quot; - 100% Money-back Guarantee', 'BESTSUN USB Rechargeable Bike Light Set, Super Bright Bike Headlight, Bike Front Lights and Back Safety Rear Flashlight, Easy Installation &amp; IP65 Waterproof, for Kids Men Women Safe Cycling At Night', '5000 Lumen Bright Headlight Headlamp Flashlight Torch 3 CREE XM-L2 T6 LED with Rechargeable Batteries and Wall Charger for Hiking Camping Riding Fishing Hunting'], 'ratings': [5.0, 5.0, 5.0, 5.0, 5.0, 5.0, 5.0, 5.0, 5.0, 5.0]}","{'items': ['Trailite 200 Lbs / 90 Kgs Digital Hand Dynamometer Grip Strength Measurement Meter Auto Capturing Hand Grip Power', 'CAMRY Digital Hand Dynamometer Grip Strength Measurement Meter Auto Capturing Hand Grip Power 200 Lbs / 90 Kgs', 'CAMRY Digital Hand Dynamometer Grip Strength Measurement Meter Auto Capturing Hand Grip Power 200 Lbs / 90 Kgs', 'Training Knife, Black Handle', 'Ultra BRIGHT LED Headlamp - Fully Adjustable - Includes Red Beam - Fully Dimmable - Strobe Light - 100% Water Resistant - Perfect for: Camping, Running, Fishing, Reading, Hunting, DIY &amp; Much More', 'Ronin Gear Skeletonized Stainless Steel Practice Butterfly Balisong Knife trainer', 'DesertWolf Retro Canvas Leather Backpack Hiking Rucksack Fit 19&quot; Laptop', 'Wine Chiller From Cucina Casa - 3-in-1 Featuring Aerator, Cooler and Spout Pourer - Elegant Stainless Steel Stick - The Perfect Gift for Men and Women.', '3V Gear Velox II Large Tactical Assault Backpack, MOLLE Compatible for Military Gear, Outdoors, Survival, Hiking, Bug Out Bag Backpack (Black, Grey, Tan, OD)', 'Escrima Kali Arnis Weapons Stick Bag'], 'ratings': [5.0, 5.0, 5.0, 5.0, 4.0, 5.0, 5.0, 5.0, 5.0, 5.0]}"
55159c987dc168f83ec54232e1192f66,sports_and_outdoors,eval,amazon_sports_and_outdoors,https://cseweb.ucsd.edu/~jmcauley/datasets/amazon_v2/,"{'items': ['Willow Creel Basket 13&quot; x 6&quot; x 7&quot;', 'Mister Twister Exude Curl Tail, White, 3-Inch', 'Michigan State Spartans 2014 Rose Bowl Champions White Panel Football', 'Conquest Scents Hunters Pack Vs-1 and Ever Calm Stick', 'Black Diamond Sprinter Headlamp', 'Schwinn IC2 Indoor Cycling Exercise Bike', 'Lunkerhunt Walking Drop Shot', 'CamLockBox Box for Moultrie M-80, M-100 and M80X, Camo', 'NAP Apache Drop-Away Rest Right Hand Camo 360 Degree Sound Dampening', 'Morrell Yellow Jacket Crossbow Bolt Discharge Bag Archery Target - for Safely Discharging Crossbow Bolts After Hunting'], 'ratings': [3.0, 5.0, 5.0, 3.0, 5.0, 3.0, 5.0, 5.0, 5.0, 5.0]}","{'items': ['Saucony Drylete Skull Cap', 'Eurosocks Patented Recovery Graduated Compression OTC Socks', 'Hunter Safety System Pro Series Safety Harnesses', 'South Bend Pyramid Sinker', 'Buck 0220BLS Knives Silver Creek Folding Fillet Fishing Knife', 'Nathan Speed 4R Belt', 'Vexilar SP0007 Red/Black Soft Pack Case for Pro Pack/Ultra Pack', 'Evans Sports Magnum Sports Bucket', '3M Worktunes Wireless Hearing Protection with Bluetooth Technology and AM/FM Radio', 'Rebel Lures Wee-Crawfish Fishing Lure'], 'ratings': [4.0, 5.0, 5.0, 5.0, 5.0, 4.0, 3.0, 4.0, 5.0, 5.0]}","{'items': ['Acme Thunderbolt Spoon', ' NCAA Michigan State Spartans Wind Sock ', 'Michigan State Spartans All Time Greats Trading Cards Box 36 Packs of 8 First Edition', ""Columbia Men's Upland Jean II"", 'Saucony Epic Run Jacket', ""Saucony Women's Ethereal Run Jacket"", ""Columbia Men's Camo Watertight Jacket"", 'NCAA Michigan State 10 x 10 Slant Leg Canopy Wall', 'Celsius Ice Tool Kit', 'Sufix Performance 50-Yards Spool Size Tip Up Ice Braid Line (Black, 15-Pound)'], 'ratings': [5.0, 5.0, 4.0, 5.0, 5.0, 5.0, 5.0, 5.0, 5.0, 4.0]}","{'items': [""prAna Women's Tote Mat Holder"", 'Northland Fireball Jig-4 Per Card (1/4-Ounce, Orange)', 'Berkley PowerBait Ripple Shad Fishing Bait', ""Yo-Zuri Pin's Minnow Floating Lure, Baby Bass, 2 3/4-Inch"", 'High Tech TU-1 Windlass Tip-Up TU-1 500 Foot Spool Black with Drag', 'Allen Archery String Loop Release Aid (Pack of 3)', 'Bass Assassin Bang Fish Attractant Trigger Spray', 'Nalgene Tritan Wide Mouth BPA-Free Water Bottle', 'Strikemaster Mora Hand Auger Replacement Blades', 'Coleman Grill Stove Griddle'], 'ratings': [5.0, 5.0, 5.0, 5.0, 5.0, 5.0, 5.0, 5.0, 5.0, 5.0]}","{'items': ['NCAA 3-by-5 Foot Flag With Grommets', 'Coleman #21 Instaclip Mantles: 2-Pack, Model 21B132C', 'Topeak Alien II Multi Tool', 'LimbSaver S-Coil Bow Stabilizer, 4-1/2 Inches', 'Allen Braided Bow Sling', 'True-Fire Hurricane HC-EX-B Extreme Compound Bow Release Aid Buckle', 'Gaiam Total Body Balance Ball Kit - Includes Anti-Burst Stability Exercise Yoga Ball, Air Pump, Workout Program', '3M WorkTunes Hearing Protector with AM/FM Radio', 'Rapala Clipper Combo', 'Promar 32-Inch Lobster and Crab Net'], 'ratings': [3.0, 5.0, 5.0, 4.0, 5.0, 5.0, 5.0, 5.0, 5.0, 5.0]}"
246192f6d1e39734dc4d646118255147,sports_and_outdoors,eval,amazon_sports_and_outdoors,https://cseweb.ucsd.edu/~jmcauley/datasets/amazon_v2/,"{'items': ['Lucco Aluminum Carabiner Keychain, Durable Spring Snap Key Chain Clip Hook Screw Gate Buckle For Home, Camping, Fishing, Hiking, Traveling', 'Ultralight Backpacking Canister Camp Stove with Piezo Ignition 3.9oz', 'ALPS OutdoorZ Commander + Pack Bag', 'Sawyer Products Mini Water Filtration System', '3CERA&reg; Large Ferrocerium Rod 1/3&quot;x3.5&quot; Flint Fire Starter Magnesium Tool Kits Camping Hiking Striker tool', 'Solo Stove Lite - Compact Wood Burning Backpacking Stove', 'Vktech 10 Plates Folding Camping Picnic Cooker Stove Wind Screen Windshield', 'ALPS Mountaineering Comfort Series Air Pad', 'ALPS Mountaineering Comfort Series Air Pad', ""Men's US Waterproof Ripstop Hooded Nylon Festival Poncho in Olive Green""], 'ratings': [5.0, 5.0, 5.0, 5.0, 2.0, 5.0, 5.0, 5.0, 5.0, 5.0]}","{'items': ['The Friendly Swede Paracord Bracelet with Fire Starter - Extra Beefy Adjustable Premium Survival Bracelets - Adjustable Size Fits 7-9 Inch Wrists', 'Nalgene BPA Free Tritan Oasis Canteen 32 Oz Narrow Mouth Bottle', 'S.O.L. Survive Outdoors Longer Escape Bivvy Orange, 70 Percent Heat Reflective, Breathable Personal Shelter, Lightweight Emergency Survival Sleeping Bag Sack, Drawstring Bag, Water-Resistant, 8.1oz', 'S.O.L. Survive Outdoors Longer Escape Bivvy Orange, 70 Percent Heat Reflective, Breathable Personal Shelter, Lightweight Emergency Survival Sleeping Bag Sack, Drawstring Bag, Water-Resistant, 8.1oz', 'Xtreme Bright Camping Lantern - Fully Collapsible with 7 LED Lights, Weighs only 6 Oz.', 'Sierra Dawn Campsuds Outdoor Soap Biodegradable Environmentally Safe All Purpose Cleaner, Camping Hiking Backpacking Travel Camp, Multipurpose for Dishes Shower Hand Shampoo', 'Klean Kanteen Classic Single Wall Stainless Steel Water Bottle with Leak Proof Loop Cap', 'S.O.L. Survive Outdoors Longer 95 Percent Heat Reflective Sport Utility Blanket', 'Klean Kanteen Cafe Cap', 'BLACKHAWK! SERPA CQC Concealment Holster - Matte Finish'], 'ratings': [5.0, 5.0, 4.0, 5.0, 5.0, 5.0, 5.0, 5.0, 5.0, 5.0]}","{'items': ['UTG Deluxe Universal Horizontal Shoulder Holster', 'Spyderco Tenacious Plain Edge Folding Knife, Black/Silver', 'UTG Special Ops Universal Leg Holster - Gen II', 'UTG 547 Law Enforcement Tactical Vest', ' KA-BAR Full Size US Marine Corps  Fighting Knife, Straight', 'Tapco MNT90302 Ultimate Accessory Rail Set, Black', 'South Bend Frog Spear', 'KA-BAR 1216 Full-size Black Hard Knife Sheath', 'Real Avid .223 Chamber Cleaning Pads', 'H2O Survival Water Filter Travel Straw MAX, 530 Gallons'], 'ratings': [5.0, 5.0, 5.0, 5.0, 5.0, 5.0, 4.0, 5.0, 3.0, 4.0]}","{'items': ['J&amp;E Machine Black Ops Tactical&Acirc; AR15 AR 15 Front and Rear 45 Degree Rapid Transition BUIS Backup Iron Sight', 'UST StarFlash Mirror/JetScream Whistle Combo', 'ER Emergency Ready Water Preserver Concentrate', 'Esbit CS585HA 3-Piece Lightweight Camping Cook Set for Use with Solid Fuel Tablets', 'Earth Pak -Waterproof Dry Bag - Roll Top Dry Compression Sack Keeps Gear Dry for Kayaking, Beach, Rafting, Boating, Hiking, Camping and Fishing with Waterproof Phone Case', 'Kimlee Multi-Functional Shoulder Sling Bag Cross Body Chest Pack Hiking Cycling Bicycle Bag', 'Himal 1 PCS Folding Collapsible Travel Hiking Walking Stick Trekking Pole with EVA Foam Handle (Red-Black)', 'Youphoria Yoga Yoga Mat 1/4&quot; Thick Eco Friendly Lightweight Comfortable High Density Memory Foam Mats - Improve Your Bikram, Ashtanga, and Hot Yoga - Bonus Carry Strap Included - Order Today!', 'Berkey GSPRT 22-Ounce Sport Purification Bottle', 'Stanley Camp 24oz. Cook Set'], 'ratings': [5.0, 5.0, 5.0, 5.0, 5.0, 5.0, 5.0, 5.0, 5.0, 5.0]}","{'items': ['Nikon P-223 3-9x40 Mate BDC 600', 'Nikon P-223 BDC 600 Riflescope with Rapid Action Turret, Black, 4-12x40', 'Rodut (TM) Adjustable Right Handed Tactical Leg Holster For Pistol,', 'Cold Steel SC92SF Sheath, Cordura Special Forces Shovel', 'Primos Hunting 3755 Turbo Dogg Electronic Predator Call', ""Thermacell Camper's Kit : Mosquito Repellent Appliance Olive, Holster Olive+ 2 single refills"", 'Beretta Grips for 92/96 Walnut with Oval Checkering', 'Solo Stove Campfire &amp; 2 Pot Set Combo: 4+ Person Wood Burning Camping Stove. Outdoor Kitchen Kit for Backpacking, Camping, Survival. Burns Twigs - NO Batteries or Liquid Fuel Gas Canister Required.', 'BLACKHAWK! Serpa Sportster Holster', 'CONDOR Recon Chest Rig'], 'ratings': [5.0, 5.0, 3.0, 5.0, 5.0, 5.0, 4.0, 5.0, 5.0, 5.0]}"
f68d5149169cbe80ee6948927027d027,sports_and_outdoors,eval,amazon_sports_and_outdoors,https://cseweb.ucsd.edu/~jmcauley/datasets/amazon_v2/,"{'items': ['BCB ADVENTURE Tinder Card (18 Strips)', 'MSR MIOX Purifier', 'Zippo Handwarmer (Realtree, 4.80 x 10.80 x 14.10)', 'Nalgene Easy Sipper - Designed specifically for your NALGENE 32 Oz wide mouth bottle', 'GSI Outdoors Glacier Stainless Bottle Cup/Pot, 20 fl oz', 'Grabber MPI Space All Weather Blanket/Tarp', 'Grabber Outdoors The Original Space Brand Emergency Tactical-Survival Blanket- Olive-Drab/Silver (Pack of 3)', 'Crimson Trace LG-435 Laserguard Red Laser Sight for KEL-TEC PF9 Pistols', 'Maxpedition Doppelduffel Adventure Bag', '5.11 RUSH24 Military Tactical Backpack, Molle Rucksack Bug Out Bag, Medium, Style 58601'], 'ratings': [5.0, 3.0, 5.0, 1.0, 5.0, 5.0, 3.0, 4.0, 5.0, 5.0]}","{'items': ['Best Glide ASE Survival Fishing Kit - Basic Version', 'Maxpedition Doppelduffel Adventure Bag', 'SE CCV18 Wristband Compass', 'Smith &amp; Wesson Handcuff Key, Extra Security', ""Kelty Noah's Tarp - in various sizes"", 'CRKT Shenanigan Z EDC Folding Knife: Utility Everyday Carry, Bead Blast Blade, Flipper Open, Locking Liner, Textured Black Nylon Frame Handle, Pocket Clip K480KKP', 'American Outdoor Products Astronaut Neapolitan Ice Cream Sandwich, 1.0 oz, (Pack of 10)', 'Fitbit Wireless Activity/Sleep Tracker, Black/Blue', ""Mylar Men's Emergency Thermal Blankets (10 Pack)"", ""O'Neill Reactor Reef Boot (Black/Coal)""], 'ratings': [4.0, 5.0, 5.0, 5.0, 5.0, 5.0, 5.0, 5.0, 3.0, 5.0]}","{'items': ['Premier Kayak Paddle Splash Guards. 4 PACK. Greatly reduces paddle drip. Two pairs for two paddles.', 'Premier Kayak Gripper Paddle Leash.', 'Gear Up Hang-2 Deluxe Kayak Storage Strap, Black', 'Pacific Dry Goods Bilge Sponge (Yellow)', ""Boater's Sponge"", 'Harmony Super Sponge', 'Seattle Sports Super Deluxe Bilge Pump', 'APCC 1/4&quot; x 100 FT. Shock Cord - BLK', 'Yakgrips No-Slip Waterproof Kayak Paddle Grips for Your Kayaking Accessories, Kayak Gear for Men and Women - Cascade Creek &hellip;', 'Kelty Shadehouse Basecamp Shelter'], 'ratings': [3.0, 1.0, 5.0, 4.0, 4.0, 4.0, 5.0, 5.0, 5.0, 5.0]}","{'items': ['Grand Trunk Ultralight Hammock | Starter Hammock | Portable Camping, Hiking, Backpacking, and Travel Hammock', 'OAKLEY OO9144 Half Jacket 2.0 Sunglasses', 'Fiskars X7 Hatchet 14 Inch, 378501-1002', 'Gear Up Hang-3 Deluxe Kayak Storage Strap, Black', 'Functional Design Sleeping Bag Expander', 'Sea to Summit X-Plate', 'Open Country 4516-0085 Weekender 6-Person Cook Set', 'Wicked Tree Pack', 'Oliasports Stove Ultralight Backpacking Canister Camp Burner with Piezo Ignition 3.9oz', 'Texsport Lensatic Compass'], 'ratings': [5.0, 5.0, 5.0, 1.0, 4.0, 2.0, 4.0, 5.0, 5.0, 4.0]}","{'items': [""O'Neill Men's Dive Tropical 3mm Booties"", 'Gamo Pro Magnum .177 Cal, 7.8 Grains, Pointed, 750ct', 'Citizen Watches Mens AT0200-05E Eco-Drive Chronograph Canvas Watch', 'Sawyer Inline Adapters for Screw On Filters', 'Texsport Backpackers Stainless Steel  Copper Bottom Outdoor Camping Cookware Cook Set with Storage Bag', ""Selk'bag 4G Classic Synthetic Sleeping Bag Black Anthracite __MD by Mountain's Best Gear"", 'Optimus Terra Weekend Cookset', 'Optimus Heat Insulation Pouch', 'PackTowl Nano Light Towel', ""Nothin' Fancy NF-4""], 'ratings': [5.0, 5.0, 5.0, 5.0, 5.0, 5.0, 5.0, 5.0, 4.0, 5.0]}"
02cabc5e72b999b063f8ed628bddd548,sports_and_outdoors,eval,amazon_sports_and_outdoors,https://cseweb.ucsd.edu/~jmcauley/datasets/amazon_v2/,"{'items': [""ASICS Men's Core Singlet"", 'Gail Force Water Sports Extra Thick Saddle Float - Yellow', 'NFL 2014 Zombie Christmas Hanging Ornament 4&quot; (Kansas City Chiefs)', '10 Pack - 12 inch Multi Bullseye - Splatterburst Shooting Targets - Gun - Rifle - Pistol - AirSoft - BB Gun - Pellet Gun - Air Rifle', 'Bore Stores P-1 Silicone Treated Gun Storage Case, Grey', 'Splatterburst Targets - 12 x12 inch (5) Bullseye Reactive Shooting Target - Shots Burst Bright Fluorescent Yellow Upon Impact - Gun - Rifle - Pistol - AirSoft - BB Gun - Air Rifle', 'Bore Stores P-2 Silicone Treated Gun Storage Case, Grey', ' Remington MoistureGuard Rust Preventative Rem Cloth (10 x 10-Inch) 19902', ' UTG Multi-Functional Tactical Messenger Bag, Black', 'TekMat Glock Gun Cleaning Mat / 11 x 17 Thick, Durable, Waterproof / Handgun Cleaning Mat with Parts Diagram and Instructions / Armorers Bench Mat / Black'], 'ratings': [5.0, 5.0, 5.0, 5.0, 5.0, 5.0, 5.0, 5.0, 4.0, 5.0]}","{'items': ['Tipton Cleaning Picks', 'NIKE Tech Swoosh Cap', 'MLB St. Louis Cardinals Burnout Wash Wide Crew Neck Jersey', ""The Professional's Choice Cotton Flannel Gun Cleaning Patches, Bulk - Large Bag"", ""8oz bottle of Gunzilla, &quot;The World's Best CLP&quot;"", ""Darn Tough Vermont Men's 1/4 Merino Wool Cushion Hiking Socks"", '5.11 TDU Tactical Belt, Non-Metal, 1.5-inch, Style 59551', 'Sticky Holsters MD-4 Medium', 'Tipton Snap Cap Pistol 9 mm Luger, 5 pack', 'Tetra Gun 004B1I Gun Grease 1-Ounce Blister'], 'ratings': [5.0, 5.0, 5.0, 5.0, 5.0, 5.0, 5.0, 5.0, 5.0, 5.0]}","{'items': ['Break-Free BCF-3-1 BCF-3 Bore Cleaning Foam, 3-Ounce Non-Toxic Cop', 'Splatterburst Targets - 12 x18 inch - Silhouette Reactive Shooting Target - Shots Burst Bright Fluorescent Yellow Upon Impact - Gun - Rifle - Pistol - Airsoft - BB Gun - Air Rifle', 'Splatterburst Targets - 12 x18 inch - Silhouette Reactive Shooting Target - Shots Burst Bright Fluorescent Yellow Upon Impact - Gun - Rifle - Pistol - Airsoft - BB Gun - Air Rifle', 'Break-Free BCF-3-1 BCF-3 Bore Cleaning Foam, 3-Ounce Non-Toxic Cop', 'Crosman 12 CO2 Gram Cartridges', 'Tetra Gun 004B1I Gun Grease 1-Ounce Blister', 'Shooting Targets Gun Range Pasters Fluorescent Red 3 Inch Circle 100 Total Adhesive Stickers', 'SKLZ Gold Flex - Golf Training Aid for Strength and Tempo Training / Golf Swing Trainer', 'Under Armour Official Composite Beach Play Manhattan Volleyball, Yellow/Black', 'Bionic Gloves &ndash;Men&rsquo;s StableGrip Golf Glove W/ Patented Natural Fit Technology Made from Long Lasting, Durable Genuine Cabretta Leather.'], 'ratings': [5.0, 5.0, 5.0, 5.0, 5.0, 5.0, 5.0, 5.0, 5.0, 5.0]}","{'items': ['50 Pack - 12 inch Multi Bullseye - Splatterburst Shooting Targets - Gun - Rifle - Pistol - AirSoft - BB Gun - Pellet Gun - Air Rifle', 'Halo Headbands Sweatband Halo I Tie Version', 'Halo Headband Sweatband Super Wide Tie', 'Ping 2015 Retro Structured Golf Hat Flexfit Cap', 'ProActive Sports Groove Doctor - Retractable Brush and Groove Cleaner for Golf Clubs and Cleats', 'TaylorMade Burner Golf Balls (1 Dozen)', 'Bionic Gloves &ndash;Men&rsquo;s StableGrip Golf Glove W/ Patented Natural Fit Technology Made from Long Lasting, Durable Genuine Cabretta Leather.', ""ICICLES Women's V Golf DRF Logo Ball, White"", 'Bison Designs 38mm wide Light Duty Belt with Gunmetal Buckle', 'MARTINI 3 1/4&quot; YELLOW GOLF TEES - 2 PACKS'], 'ratings': [5.0, 5.0, 5.0, 5.0, 5.0, 5.0, 5.0, 5.0, 5.0, 4.0]}","{'items': ['Splatterburst Targets - 2 inch Stick &amp; Splatter Reactive Self Adhesive Shooting Targets - Gun - Rifle - Pistol - Airsoft - BB Gun - Pellet Gun - Air Rifle', ""adidas Golf Men's Fall Weight Pant"", 'MARTINI 3 1/4&quot; WHITE GOLF TEES - 3 PACKS', 'Trunk-It Golf Gear Storage Trunk Organizer/Locker for Car or Truck', 'Trunk-It Golf Gear Storage Trunk Organizer/Locker for Car or Truck', 'Custom Slide Cover Plates for Glock 43 T1488', 'ProActive Sports Golf Valet 3-in-1 Brush w/Nylon Cleaning Bristles Shoehorn Handle and Spike Wrench', 'STONCEL Golf Putting Alignment Tool Ball Marker w/ Hat Clip', ""NIKE Men's Tour Legacy Mesh Hat"", 'Softspikes Ultimate Cleat Brush, Colors may Vary'], 'ratings': [5.0, 5.0, 5.0, 5.0, 5.0, 5.0, 4.0, 4.0, 4.0, 4.0]}"
