id,item_type,split,dataset_name,source_url,windows_0,windows_1,windows_2,windows_3,windows_4
4af9e55ed7a7a07c5b3860d5cda7996d,sports_and_outdoors,eval,amazon_sports_and_outdoors,https://cseweb.ucsd.edu/~jmcauley/datasets/amazon_v2/,"{'items': ['IRONMAN Paradigm 100 Inversion Table System', 'IRONMAN Paradigm 100 Inversion Table System', 'Victorinox Swiss Army MiniChamp Pocket Knife', 'Gerber 46501 E-Z-Out Jr, Fine Edge Knife', 'EZ Out Jr. Fine Edge Knife', 'EZ Out Jr. Fine Edge Knife', ' Atkins Advantage Rtd Shake Strawberry - 11 Fl Oz Each - Pack Of 4', ' Swiss+Tech New Product Tool Pack', 'Swiss+Tech Utilkey 66676 Multi Tool Pocket Knife &amp; Gift Tin', 'Swiss+Tech PPCSSS-XL11 Micro-Pro KeyChain 11-in-1 MultiTool'], 'ratings': [4.0, 4.0, 5.0, 5.0, 5.0, 5.0, 4.0, 4.0, 3.0, 4.0]}","{'items': ['Victorinox Swiss Army Midnite MiniChamp Pocket Knife (Translucent Ruby)', 'Victorinox Swiss Army Midnite MiniChamp Pocket Knife (Translucent Sapphire)', 'Pittsburgh Steelers 24-Pack Premium Roller Cooler', 'Light My Fire Original Swedish FireSteel Army 12,000 Strike Fire Starter', 'Light My Fire Original Swedish FireSteel Army 12,000 Strike Fire Starter', 'Victorinox Swiss Army Pocket Knife', 'Casino 6-Deck Automatic Card Shuffler', 'FastDraw Serrated Knife', 'Federal Holsterworks Holster for Walther PPK &amp; PPK/S with built-in Magazine Pouch', 'Federal Holsterworks Holster for Walther PPK &amp; PPK/S with built-in Magazine Pouch'], 'ratings': [5.0, 5.0, 4.0, 5.0, 5.0, 5.0, 4.0, 4.0, 5.0, 5.0]}","{'items': ['EZ-Towel with New Durable Tube and Packaging, 50 Pieces', ' Maurice Sporting Goods 50Ct Comp Disp Towel Ezt120-50 Fisherman&#39;s Tools ', 'Sabre Red Key Case Pepper Spray with Quick Release Key Ring - Police Strength - 25 Bursts &amp; 10-Foot (3m) Range with Practice Spray Option', 'Sabre Red Key Case Pepper Spray with Quick Release Key Ring - Police Strength - 25 Bursts &amp; 10-Foot (3m) Range with Practice Spray Option', 'KJB Security P126 Sabre Red Pepper Spray - Pink', ""Allen Company Heavy Canvas Shooter's Carry All"", '10 - ct. Tube of EZ Towels', 'EZ-Towel with New Durable Tube and Packaging, 50 Pieces', ""Birchwood Casey Dirty Bird 8&quot; Multi-Colour Bull's-Eye Target (Pack of 20)"", 'Birchwood Shoot&bull;N&bull;C Self-Adhesive Targets'], 'ratings': [5.0, 5.0, 4.0, 4.0, 4.0, 5.0, 5.0, 5.0, 5.0, 5.0]}","{'items': ['Howard Leight by Honeywell QM24+ Multi-Position Dielectric Safety Earmuff (QM24), Red', 'TMAS Steel Leg Stretcher', 'Tiger Claw Steel Leg Stretcher Blue', 'Century VersaFlex Stretching Machine', 'Century VersaFlex Stretching Machine', 'SPRI Tri-Fold Exercise Mats', 'Brown Focus Mitt', 'Century Kickboxing Sparring Boot', ' Cold Steel 92R13RT Rubber Training, Recon Tanto ', ' Cold Steel 92R13RT Rubber Training, Recon Tanto '], 'ratings': [4.0, 4.0, 4.0, 4.0, 4.0, 5.0, 4.0, 4.0, 5.0, 5.0]}","{'items': ['Everlast 4214 Leather Speed Bag (Small, 10&quot;x7&quot;)', 'Black XL Training Gloves ~ Boxing, Kickboxing, Fighting', 'NEW RED XL PAIR OF PUNCHING BOXING GLOVES KICK BOXING', 'Everlast 4455-3 3-Pk. Hand Wraps', '10 - ct. Tube of EZ Towels', 'EZ-Towel with New Durable Tube and Packaging, 50 Pieces', ' Marcy Classic Standard Bench with Arm Curl', 'US Weight 100 lb. Traditional Barbell Weight Set with New Upgraded Bar and Spring Locking Clips - Includes 20, 20 and 8 lb. Weights', 'EZ-Towel with New Durable Tube and Packaging, 50 Pieces', 'Century The Original Wavemaster Freestanding Training Bag'], 'ratings': [4.0, 3.0, 3.0, 4.0, 5.0, 5.0, 5.0, 4.0, 5.0, 4.0]}"
2235abdac053efebedfa4ce5958d4627,sports_and_outdoors,eval,amazon_sports_and_outdoors,https://cseweb.ucsd.edu/~jmcauley/datasets/amazon_v2/,"{'items': ['Softspikes PULSAR Fast Twist Golf Cleats', 'Bushnell Trophy TRS-25 Red Dot Sight Riflescope, 1x25mm, Black', '3M Peltor Tactical 6S Active Volume Hearing Protector', 'EOTECH 512 Holographic Weapon Sight - 1 Dot Speed Ring Reticle', 'AimPoint 4 Minute of Angle CompML3 Sight', 'Harris Engineering S-BRM Hinged Base 6-9-Inch BiPod', 'Sightmark 9mm Luger Laser Boresight', 'ACOG 3 X 30 Scope Dual Illuminated Chevron .223 Ballistic Reticle', 'ACOG 3 X 30 Scope Dual Illuminated Chevron .223 Ballistic Reticle', 'ACOG 3 X 30 Scope Dual Illuminated Chevron .223 Ballistic Reticle'], 'ratings': [4.0, 2.0, 3.0, 4.0, 5.0, 5.0, 3.0, 5.0, 5.0, 5.0]}","{'items': ['Spyderco Tenacious Plain Edge Folding Knife, Black/Silver', 'Smart Socks Merino Mid Weight Crew Sock', ""adidas Men's RESPONSE Traditional Polo"", 'Thermos Stainless King 16-Ounce Travel Tumbler, Cranberry', 'Protec Classic Helmet', 'G.1 Airsoft 6mm Pistol Metal Zinc Alloy Shell Hand Gun', 'Powell Golden Dragon Flying Dragon Complete Skateboard', 'Powell Golden Dragon Flying Dragon Complete Skateboard', 'CAP Barbell Pair of Push Up Bars', 'Valeo Ab Roller Wheel - Exercise Wheel for Home Gym - Fitness Equipment &amp; Accessories'], 'ratings': [5.0, 5.0, 4.0, 5.0, 4.0, 4.0, 5.0, 5.0, 4.0, 4.0]}","{'items': ['GRIP MASTER Gripmaster Pro Edition', 'MISSION Athletecare Court Grip', 'Harbinger Padded Handle Push-Up Bars (Pair)', ""PUMA Men's PU911011005 FAAS Digital Watch"", ' Planet Bike A.R.S. Spring bike seat - men&#39;s ', ' Planet Bike A.R.S. Spring bike seat - men&#39;s ', 'Polar Insulated Water Bottle Solid Red 24oz', 'SHIMANO Brake Cable End Cap 10 Pack (1.6mm)', 'SHIMANO Derailleur Cable End Cap X10 (Silver, 1.2-mm)', 'Ibera Bicycle Lightweight Aluminum Water Bottle Cage'], 'ratings': [5.0, 4.0, 5.0, 3.0, 5.0, 5.0, 4.0, 5.0, 5.0, 5.0]}","{'items': [""Pearl Izumi Men's Infinity Short"", ""Pearl iZUMi Men's Quest Cycling Short"", ""Saucony Run Lux II Women's Short"", ""Saucony Run Lux II Women's Short"", ""adidas Men's Response DS 7-Inch Short"", 'Topeak Sport II Floor Pump', 'Park Tool (109917) HCW-5 Lock Spanner', 'Park Tool CN-10 Professional Cable/Housing Cutter', 'Avenir Pro Spoke Wrench Set', 'Avenir Pro Spoke Wrench Set'], 'ratings': [4.0, 4.0, 5.0, 5.0, 5.0, 5.0, 5.0, 5.0, 5.0, 5.0]}","{'items': ['Kool Stop Supra 2, Linear Pull Pads, Threaded Posts, Salmon, Pair', 'Dimension Threadless Stem: 70mm; 107 Degree; 25.4; Black', ' IceToolz Fourth Hand Cable Puller ', ""Oakley Golf Apparel Men's Elemental Short Sleeve Polo"", 'Magellan Switch Up Crossover GPS Watch with Mounts and Heart Rate Monitor', 'Intech Golf Tee 2 3/4&quot; 500 Pack (White)', 'Callaway Hex Black Tour Golf Ball (12 Pack)', 'Intech Golf Tee 2 3/4&quot; 500 Pack (White)', 'TRUGLO Tru-Bead Dual-Color Universal Fiber Optic Sight', 'Bulldog Cases Extreme Scoped Rifle Case'], 'ratings': [4.0, 5.0, 5.0, 4.0, 2.0, 5.0, 5.0, 5.0, 1.0, 5.0]}"
18e151216406621a76ee870be9ef90de,sports_and_outdoors,eval,amazon_sports_and_outdoors,https://cseweb.ucsd.edu/~jmcauley/datasets/amazon_v2/,"{'items': ['Burley Travoy Bike Trailer', 'Rubbermaid Shaker Bottle, 20 Ounce, Black 1906641', 'Perfect Fitness Pushup Stands', 'Saris The Hottie Two Bike Home Storage, White', 'Simmons 801600 Volt 600 Laser Rangefinder', 'Shock Doctor Ultra Mouth Guard for Braces, Protects Your Dental Braces, Football, Lacrosse, Basketball, Baseball', 'Shock Doctor Mouthguard: #1 Sport Mouth Guard - Gel Max Mouthguard for Football, Lacrosse, Basketball, Boxing, MMA, Martial Arts, and More - Includes Helmet Strap - (Youth &amp; Adult Sizes)', 'Shock Doctor Adult Gel Nano Flavor Fusion  Convertible Mouth Guard', 'Guard Dog Hybrid Scratch Resistant Armor Case with Screen Protector for iPhone 6 - Retail Packaging - Black with Deep Maroon Trim', 'Shock Doctor Low Profile Convertible Lip Guard, Adult, Assorted Colors'], 'ratings': [4.0, 4.0, 4.0, 5.0, 5.0, 5.0, 4.0, 5.0, 3.0, 5.0]}","{'items': ['Shock Doctor Mouthguard: #1 Sport Mouth Guard - Gel Max Mouthguard for Football, Lacrosse, Basketball, Boxing, MMA, Martial Arts, and More - Includes Helmet Strap - (Youth &amp; Adult Sizes)', 'Ultega Slackline 49 ft', 'Peg Perego 10+ Rear Mount Child Seat', 'Viva Sol Miniature Version of Classic Bean Bag Toss Game Perfect for a Desk or Table', 'Contigo AUTOSPOUT', 'Ultimate Direction Access 10-Plus Waistpack', 'STAGE PG Junior Goggle', 'WWE Create A Superstar Bray Wyatt Figure Pack', 'WWE Create A Superstar John Cena Figure Pack', 'Franklin Sports Playbook Football'], 'ratings': [4.0, 5.0, 4.0, 4.0, 5.0, 3.0, 3.0, 4.0, 4.0, 3.0]}","{'items': ['SKLZ Accelerator Pro - Indoor Putting Green With Ball Return (9 feet x 16.25 Inches)', 'Franklin Sports RTP Teeball Performance Gloves - 9.5&quot;', ' Armitron Sport Men&#39;s 408177RED Chronograph Black and Red Digital Watch', 'Gaiam Restore Hand &amp; Arm Therapy Bar', 'Triumph Tournament Bean Bag Toss Game with 2 Easy Transport Game Platforms with Scratch Resistant Surface, Convenient Carry Handle and 8 Toss Bags', 'Cressi Skylight, Clear-White/Black, Clear Lens', 'SKLZ Solo Assist Basketball Rebounder', 'Combat Sports Curved Kickboxing Muay Thai MMA Training Kick Punch Strike Shield Thai Pad Kick Shield', 'White Lightning - Matte Finisher, Aerosol Matte Finish Bicycle Cleaner, 19oz', 'SPRI Power Push Up Stand'], 'ratings': [4.0, 5.0, 1.0, 4.0, 4.0, 5.0, 3.0, 3.0, 5.0, 4.0]}","{'items': ['Epson M-Tracer MT500GII Golf Swing Analyzer', 'Shock Doctor AirCore Protective Cup, Youth &amp; Adult sizes', 'Shock Doctor AirCore Protective Cup, Youth &amp; Adult sizes', 'Shock Doctor Adult 373 Ultra Compression HK Short Hard Cup', 'RampShot Game Set- Cornhole on Steroids, Great for Families, Yard, Beach, Tailgate, Camping - Includes 2 Ramps, 4 Balls, 2 Stickers, 2 Nets, and Instructions', 'Shock Doctor Athletic Supporter Jock w/ Aircore Protective Cup, Youth &amp; Adult', 'Shock Doctor Athletic Supporter Jock w/ Aircore Protective Cup, Youth &amp; Adult', 'Franklin Sports Aquaticz Water Polo (1 Target)', 'Gaiam Yoga Sand Bag, Navy', 'Gaiam Kids Zabuton Meditation Floor Cushion, Green'], 'ratings': [5.0, 4.0, 4.0, 4.0, 3.0, 4.0, 4.0, 5.0, 4.0, 4.0]}","{'items': ['Gaiam Yoga Wedge, Deep Purple', 'SPRI Accessory Storage Bag', ""Pinemeadow PGX 500 Driver (Men's, Right Hand, Graphite, Regular)"", 'Groove Caddy Golf Club Cleaner, White/Black', 'Jef World of Golf JR647 Universal Club Brush', 'Franklin Sports Hockey Shooting Target - NHL - Tuukka Rask - Fits 72 Inch Goal', 'Franklin Sports NHL Mini Player Helmet', 'Franklin Sports Table Top Sports Games-Stocking Stuffers', 'Franklin Sports Field Master Shin Guard and Sleeve', ""Reebok Women's Training Fitness Glove, Camo Print""], 'ratings': [4.0, 3.0, 4.0, 3.0, 3.0, 3.0, 2.0, 4.0, 4.0, 4.0]}"
326dbbd7db3c3b7c24774896454abf28,sports_and_outdoors,eval,amazon_sports_and_outdoors,https://cseweb.ucsd.edu/~jmcauley/datasets/amazon_v2/,"{'items': ['BOB Yak Trailer In Black', 'Camp Corsa Ice Axe', 'MSR AutoFlow Gravity Filter', 'Atom Pintail Super Carver Longboard', 'Dimension 110 x 44t BMX Chainring', 'SOG SOGfari 18&quot; Machete MC02-N - Hardcased Black Blade w/Saw Back, Rubber Handle, Nylon Sheath', 'Husqvarna 531309565 Chain Saw Apron Chaps, Gray/Blue', 'Husqvarna 531309565 Chain Saw Apron Chaps, Gray/Blue', 'Black Diamond ATC-Guide Belay Device', 'Black Diamond ATC Guide Belay Device - Platinum'], 'ratings': [5.0, 5.0, 5.0, 4.0, 5.0, 2.0, 5.0, 5.0, 5.0, 5.0]}","{'items': ['Black Diamond Alpine Bod Harness', 'Rothco Nylon Paracord', 'Dakine Freestyle Snowboard Bag', 'Northstar 1050 HD Tuff Cloth Diamond Ripstop Series Gear/Duffle Bag (18-Inch x 42-Inch)', 'niceEshop 4 Digit Manual Hand Tally Mechanical Palm Click Counter', '12 Shiny Black&reg; 30&quot; Fiberglass Target Practice Arrows', 'Easton 6 - Pk Genesis II Arrows, ORANGE', 'Gamo Raptor PBA .177 Cal, 5.4 Grains, Round Nose, 100ct', 'Bell Dawn Patrol LED Headlight', 'Gamo Raptor PBA .177 Cal, 5.4 Grains, Round Nose, 100ct'], 'ratings': [3.0, 5.0, 5.0, 5.0, 5.0, 3.0, 5.0, 5.0, 4.0, 5.0]}","{'items': ['Do-All Outdoors Air Strike Pellet Shooting Target Rated for 800fps Airgun', 'Elixir Golf Sun Protection Arm Cooling Sleeve', 'Crosman Destroyer Pellets.177 Caliber, 4.5mm, 250ct', 'Crosman Destroyer Pellets.177 Caliber, 4.5mm, 250ct', 'Ultra Pro 100 Topload Card Holders with 100 Ct Bag of Sleeves', 'niceEshop Waterproof Double White LED Light with Black Silicone for Bicycle', ""Baleaf Men's 3D Padded Bike Bicycle MTB Cycling Underwear Shorts"", 'Ultra Pro 100 Topload Card Holders with 100 Ct Bag of Sleeves', 'SE FS374 All-Weather Emergency 2-IN-1 Fire Starter and Magnesium Fuel Bar, Flint and Steel Kit', 'SE FS374 All-Weather Emergency 2-IN-1 Fire Starter and Magnesium Fuel Bar, Flint and Steel Kit'], 'ratings': [5.0, 3.0, 5.0, 5.0, 5.0, 1.0, 4.0, 5.0, 5.0, 5.0]}","{'items': ['Monstrum Tactical BP02 Tactical Rucksack', 'Voberry New Bike Bicycle Red LED Rear Light 3 modes Waterproof Tail Lamp Quick Release', 'Denver Broncos NFL Zombie Christmas Ornament', 'JOOLA 40mm 3-Star Table Tennis Training Balls (12 Count)', 'JOOLA 40mm 3-Star Table Tennis Training Balls (12 Count)', 'Louisville Slugger WB180BB-NA 180 Natural Baseball Bat', 'MICHELIN Airstop Cyclocross Tube', 'MICHELIN Airstop Cyclocross Tube', 'Trumark Slingshots Power Bands Heavy Pull with 303 Protectant', ' Energizer Waterproof LED Lantern, Weatheready Folding Light, 350 Hour Run Time, 500 Lumens '], 'ratings': [4.0, 1.0, 5.0, 4.0, 4.0, 5.0, 5.0, 5.0, 5.0, 5.0]}","{'items': ['Stansport Reinforced Brown Rip-Stop Tarp', 'Cane Creek Flat Top Road brake levers, black', 'Park Tool Freewheel Remover: Sun Tour 2 Notch', 'Swagman Park 3 Bike Storage Rack', ' SHIMANO Freewheel Removal Tool ', 'Outdoor Research Sombriolet Sun Hat', 'Park Tool FR-1 Freewheel Remover for Shimano Freewheels', 'Park Tool Freewheel Remover: Sun Tour 2 Notch', 'Timex Full-Size Ironman Rugged 30 Watch', 'Nayoya Gymnastic Rings for Full Body Strength and Muscular Bodyweight Training'], 'ratings': [4.0, 5.0, 5.0, 5.0, 5.0, 5.0, 5.0, 5.0, 4.0, 5.0]}"
9342a0ae4be615cd078c624b789c6074,sports_and_outdoors,eval,amazon_sports_and_outdoors,https://cseweb.ucsd.edu/~jmcauley/datasets/amazon_v2/,"{'items': ['Blackburn Mars 1.0 Flasher Rear Bicycle Light', 'Planet Bike Blaze 45 bike headlight', 'Blackburn Mars 1.0 Flasher Rear Bicycle Light', 'Planet Bike 3018-1 Rack Blinky 5-5 LED Tail Light with Rack Mount and Batteries', 'Planet Bike Superflash bike tail light', 'Planet Bike 3018-1 Rack Blinky 5-5 LED Tail Light with Rack Mount and Batteries', ' Schwinn Bicycle Handlebar Bag ', 'Grand Trunk Ultralight Hammock | Starter Hammock | Portable Camping, Hiking, Backpacking, and Travel Hammock', ' Dri Duck Light Weight Hooded Rain Suit ', 'MTECH USA MT-122BK Fixed Blade Knife 12-Inch Overall'], 'ratings': [4.0, 4.0, 4.0, 3.0, 5.0, 3.0, 2.0, 5.0, 4.0, 4.0]}","{'items': ['Rothco Gi Style Pilots Survival Knife', 'Ontario Knife ONSP1-BRK Marine Combat', 'Ontario Knife ONSP1-BRK Marine Combat', 'Emberlit Titanium UL Compact Design Perfect for Survival, Camping, Hunting &amp; Emergency Preparation', 'MTECH USA MT-151 Fixed Blade Knife 14.5-Inch Overall', 'MTECH USA MT-096 Fixed Blade Knife 14-Inch Overall', 'Ka-Bar 1282 D2 Extreme Fighting Knife', 'KA1214-BRK USA Fighting Knife', 'STERIPEN CLASSIC SAFE WATER SYSTEM', 'UCO 9-Hour White Candles for UCO Candle Lanterns and Emergency Preparedness'], 'ratings': [1.0, 5.0, 5.0, 5.0, 1.0, 1.0, 5.0, 5.0, 5.0, 4.0]}","{'items': ['MTECH USA MT-092 Fixed Blade Knife 14-Inch Overall', 'UCO Original Collapsible Candle Lantern', 'Emberlit Stainless Steel stove,Compact Design Perfect for Survival, Camping, Hunting &amp; Emergency Preparation', 'Black Diamond Spot Headlamp', 'Advanced Elements (SS761) Summer Solar Shower - 3 Gallon', 'Morakniv Companion Fixed Blade Outdoor Knife with Sandvik Stainless Steel Blade, 4.1-Inch', 'Emergency Zone Brand Honey Bucket Emergency Toilet Seat', ""Coghlan's Tent Stakes - Set of 4"", 'MSR Alpine Stowaway Pot', 'Light my Fire Titanium Spork'], 'ratings': [5.0, 5.0, 5.0, 5.0, 5.0, 5.0, 4.0, 5.0, 5.0, 5.0]}","{'items': ['Sea to Summit Nylon 66 Pocket Trowel', ""Coghlan's Backpacker's Trowel"", 'Seattle Sports Kayak Anchor Kits', 'Seattle Sports Kayak Anchor Kits', 'UCO Tealight Candles for Lanterns and General Use (Pack of 6)', 'Hobie Rod Leash - Webbing', 'Future Beach Sit-On-Top Fishing Kayak', 'ADVANCED ELEMENTS 10-Gallon Summer Shower', 'Seattle Sports Camp Sink', 'Nalgene Wide Mouth Water Cantene'], 'ratings': [5.0, 5.0, 5.0, 5.0, 3.0, 5.0, 5.0, 5.0, 5.0, 5.0]}","{'items': ['Bushcraft Essentials Outdoor Stove Bushbox XL', '3&quot; Folding Firebox Nano - Ultra-light Compact Backpacking Stove', 'UCO Cocoon Neoprene Cover for UCO Lantern', 'Wide Mouth Cantene', 'Firebox 5 Folding Campfire Stove + Extended Grill Plate', 'Bushcraft Essentials Bushbox XL Combination Kit', 'Gen2 Stainless Steel Folding Firebox Nano with Cordura D-Ring Case', 'Bushbox Titanium Outdoor Pocket Stove', 'Bushcraft Essentials Trivets (Set) Bushbox XL', ' PVC-Free Ultra Light Weight Pocket Bucket (Blue) '], 'ratings': [5.0, 5.0, 4.0, 5.0, 5.0, 5.0, 5.0, 5.0, 5.0, 4.0]}"
8770de860be6b3b4b3d93c5031a27183,sports_and_outdoors,eval,amazon_sports_and_outdoors,https://cseweb.ucsd.edu/~jmcauley/datasets/amazon_v2/,"{'items': ['Cold Steel 39LRST Recon Scout Black Kraton Handle with Black Blade', 'Cold Steel 39LRST Recon Scout Black Kraton Handle with Black Blade', 'Cold Steel CS36LPSS-BRK Pendleton Hunter', 'Outlaw II Tactical Gear Slinger Sling Pack, Over Shoulder Day Pack/Survival Sling Bag with MOLLE/Outdoor, Survival, Get Home Bag (Black, Grey, Tan, OD)', 'ZJchao 9 Strand 550 Luminous Glow in the Dark Paracord Parachute Cord', 'Nite Ize CamJam Cord Tightener, Lightweight Plastic Tie Down Cam Mechanism With Carabiner Clip', 'GoHiking 2 Lightweight Burner Classic Camping and Backpacking Canisters', 'Nite Ize, Inc. F9L-02-09 Large Figure 9, Silver', 'MSR Alpine Spoon', 'MSR Alpine Spatula'], 'ratings': [5.0, 5.0, 5.0, 4.0, 2.0, 4.0, 5.0, 5.0, 3.0, 2.0]}","{'items': ['MSR Universal Canister Stand', 'Outdoor Research Swift Sun Hat,One Size', ' Nite Ize Small Figure 9 Carabiner with Rope - Rope Tightener with Carabiner Clip, Black, Two-Pack', '5.11 RUSH12 Tactical Military Assault Molle Backpack, Bug Out Rucksack Bag, Small, Style 56892', 'Ultralight Backpacking Canister Camp Stove with Piezo Ignition 3.9oz', 'Witz The Wrapper Waterproof Case', 'UCO Original Collapsible Candle Lantern', 'GCI Outdoor PackSeat Portable Tripod Camping and Sports Stool', 'GCI Outdoor PackSeat Portable Tripod Camping and Sports Stool', 'Tri-Flow TFC20027 Superior Pin Point Lubricator (Blister Card Pack) - .25 oz.'], 'ratings': [5.0, 5.0, 4.0, 5.0, 3.0, 1.0, 4.0, 4.0, 4.0, 4.0]}","{'items': ['GSI Outdoors - Halulite Tea Kettle, 1 Quart, Superior Backcountry Cookware Since 1985', 'Tri-Flow TFC20027 Superior Pin Point Lubricator (Blister Card Pack) - .25 oz.', 'SUNLAND Microfiber Towel Ultra Absorbent Travel Towels Fast Drying Sports Towel Bath Gym Towels', 'SUNLAND Microfiber Towel Ultra Absorbent Travel Towels Fast Drying Sports Towel Bath Gym Towels', 'Outdoor Research Novo Watch Cap', 'GSI Outdoors Fairshare Mug II, Superior Backcountry Cookware Since 1985', 'ALPS OutdoorZ Commander + Pack Bag', 'Texsport Aluminum 9 inch Tent Nail Stakes - Pack of 4', 'Bluecell Black Color Thick Tent Footprint Waterproof Floor Saver for Camping Hiking Backpacking Picnic Shelter Shade Canopy Outdoor Activity by Generic', 'Sawyer Products Mini Water Filtration System'], 'ratings': [4.0, 5.0, 4.0, 4.0, 2.0, 4.0, 4.0, 4.0, 4.0, 4.0]}","{'items': ['Sawyer Products Squeezable Pouch for Sawyer Squeeze Filter and Mini Water Filtration Systems', 'Trumark Slingshots Ammo Steel Ball', 'Gore-Tex Medium Weight Repair Kit', 'Trumark Powerbands Heavy Pull', 'CamelBak 90856 Mil Spec Antidote Accessory Reservoir, 70 oz/2.0L', 'KENYON Polartec Fleece Neck Gaitor', 'Ultimate Survival Technologies Ultimate Survival U-DIG-IT Stainless Steel Folding Shovel w/Case', 'Kelty Red Cloud 90 Internal Frame Backpack', 'Eureka Tent, Combat One Person (TCOP)', 'Rothco Polar Fleece Neck Warmers'], 'ratings': [4.0, 4.0, 4.0, 4.0, 4.0, 5.0, 4.0, 5.0, 5.0, 5.0]}","{'items': ['UST Tube Tarp and Camping Shelter with Compact, Multifunctional Use and Reversible and Flame Retardant Construction for Emergency, Hiking, Camping, Backpacking and Outdoor Survival', 'MSR Liquid Fuel Bottle', ""Kelty Noah's Tarp Shelter"", ""Frogg Toggs Men's Waterproof Ultra-Lite2 Suit"", 'Nite Ize Figure 9 Tent Line Kit', 'MSR Expedition Simple Screw Top Replacment Fuel Bottle Cap', 'MSR Liquid Fuel Bottle', 'Thermarest Z Seat', 'Blue Foldable Folding Foam Waterproof Chair Cushion Seat Pads', 'Outdoor Products 345;Pack Ultimate Dry Sack'], 'ratings': [3.0, 4.0, 5.0, 5.0, 5.0, 5.0, 4.0, 5.0, 5.0, 5.0]}"
20ce847ca6e564eb899be5b28125811d,sports_and_outdoors,eval,amazon_sports_and_outdoors,https://cseweb.ucsd.edu/~jmcauley/datasets/amazon_v2/,"{'items': ['Bayou Fitness Total Trainer DLX Home Gym', 'Brush-T Golf Tees Combo Gift Box (9 count)', ' ReFiner 460cc Hinged Driver, Standard Grip - Mens Right Hand ', 'Bushnell Yardage Pro Scout Laser Rangefinder', 'Rife Two Bar Hybrid Mallet Heel Shafted Putter', 'Schwinn 430 Elliptical Trainer [Discontinued]', 'Swingyde Golf Swing Training Aid', 'Swingyde Golf Swing Training Aid', ' ReFiner 460cc Hinged Driver, Standard Grip - Mens Right Hand ', ""Medicus Men's Dual Hinged Oversized Driver""], 'ratings': [5.0, 5.0, 5.0, 5.0, 5.0, 5.0, 5.0, 5.0, 5.0, 2.0]}","{'items': ['BreakMaster Digital Green Reader', 'BreakMaster Digital Green Reader', 'Brush-T Multi-Pack of 4 Golf Tees (Wood, Driver, Oversized, XLT) - Low Friction, More Distance, Consistent Height', 'Brush T Oversize 2.4&quot; Long', 'Brush T Golf Tees', 'Brush T Golf Tees', 'Brush-T Multi-Pack of 4 Golf Tees (Wood, Driver, Oversized, XLT) - Low Friction, More Distance, Consistent Height', 'Brush T Oversize 2.4&quot; Long', ' Aero Spark Tee/Extra Long/Clear ', 'SKLZ Refiner Driver - Hinged Training Club'], 'ratings': [5.0, 5.0, 2.0, 2.0, 2.0, 2.0, 2.0, 2.0, 2.0, 4.0]}","{'items': ['Ben Hogan: The Golf Swing DVD', 'Ben Hogan: The Golf Swing DVD', '30 Second Golf Swing', 'SKLZ Refiner Driver - Hinged Training Club', 'Power Block Elite Dumbbells', 'Power Block Elite Dumbbells', 'Power Block Elite Dumbbells', 'Bayou Fitness Total Trainer DLX-III Home Gym', 'Winn Excel Midsize AVS Putter Grip', 'Century Original Wavemaster Freestanding Heavy Punching Bag'], 'ratings': [5.0, 5.0, 5.0, 4.0, 5.0, 5.0, 5.0, 5.0, 5.0, 4.0]}","{'items': ['Bushnell Yardage Pro Scout Laser Rangefinder (Camouflage)', 'Bushnell Yardage Pro Scout Laser Rangefinder', 'Bag Boy Compact LX Push Cart (Black)', 'Inside Approach Flextee Launch Pad Practice Aid', 'SKLZ Power Sleeve - Portable Club Weighting System', 'SKLZ Power Sleeve - Portable Club Weighting System', 'SKLZ Power Sleeve - Portable Club Weighting System', 'SKLZ Power Sleeve - Portable Club Weighting System', 'SKLZ Power Sleeve - Portable Club Weighting System', 'SKLZ Power Sleeve - Portable Club Weighting System'], 'ratings': [5.0, 5.0, 5.0, 2.0, 3.0, 3.0, 3.0, 3.0, 3.0, 3.0]}","{'items': ['Ernie Els Tempotimer Golf Club Weight', 'Nike Dymo STR8-FIT 69 Series Driver', 'SOG Pentagon Elite I Folding Knife PE14-CP - Bead Blasted 4&quot; VG-10 Blade, GRN Handle, Arc-Lock', 'Therm-a-Rest ProLite 4 Stuff Sack by', 'Therm-a-Rest Trekker Lounge 20', ""Therm-a-Rest Men's ProLite Plus Mattress"", 'Bag Boy Revolver Plus Cart Golf Bag', ' Galco Stow-N-Go Inside The Pant Holster for Glock 19, 23, 32 (Natural, Right-hand) ', 'SOG Specialty Knives &amp; Tools TF6-CP Trident Knife with Straight Edge Assisted Folding 3.75-Inch Steel Tanto Shape Blade and GRN Handle, Satin Finish', 'Galco Summer Comfort Inside Pant Holster for Glock 26, 27, 33'], 'ratings': [3.0, 5.0, 5.0, 5.0, 5.0, 5.0, 5.0, 4.0, 5.0, 4.0]}"
