id,item_type,split,dataset_name,source_url,windows_0,windows_1,windows_2,windows_3,windows_4
c6544a6b5cb38d6be193feaca3567a4f,sports_and_outdoors,eval,amazon_sports_and_outdoors,https://cseweb.ucsd.edu/~jmcauley/datasets/amazon_v2/,"{'items': [""Big Bill Northland Fleece Pants Wood 'N' Trail Camo, WOOD'N TRAIL, XL"", 'MOLLE II Standard Pack, Desert Camo, Genuine U.S. Military Issue', 'Coyote USMC Marine FILBE Rucksack Complete Pack System', 'GDT CQB Style 1x32 Red Dot Sight True Fiber Optic', 'Mil-Tec Military Army Patrol Molle Assault Pack Tactical Combat Rucksack Backpack Bag 36L Flecktarn Camo', 'SNIPER&reg;Precision Machined Aluminum Picatinny/weaver Front And Rear Combo Set Flip Up Backup', ""Duracoat Shake N' Spray 4oz Kit"", 'Magpul PTS MBUS Front &amp; Rear Back-Up Sight Set Dark Earth Color Polymer', 'Aim Sports 2-7x42 8.5-10.5&quot; Long Eye Relief 30MM SCOUT SCOPE/MIL-DOT', 'Vogelzang BX22EL Lil Sweetie Cast Iron Stove'], 'ratings': [3.0, 4.0, 5.0, 4.0, 5.0, 5.0, 5.0, 1.0, 5.0, 3.0]}","{'items': ['LCW DC479 DuraCoat 4oz Magpul Flat Dark Earth', 'UTG 3X Magnifier with Flip-to-side QD Picatinny Mount', 'Plano Single Scoped or Double Non-Scoped Rifle Case', 'Ultimate Arms Gear Gunsmith Armorer Cleaning 5 pc Kit Set Includes: 3 Double Ended 7 &quot; Brushes - Brass, Copper, Nylon &amp; 2 Nylon Double Ended Curved Picks 7 - 1/4&rdquo; For Universal Shotgun Rifle Pistol Handgun Gun', 'Grundens P762 Petrus Hooded Pullover, Green - M', 'Barska 1-4x28 IR Hunting Scope', 'SMITH SIGHTS for the Mosin Nagant - Fully Adjustable Target and Fiber Optic Front Sights', 'Condor Tactical Double Pistol Mag Pouch', 'USMC MARPAT GORE-TEX Pants Size - Medium Regular', 'Careshine LED Head Light Lamp for Dental Surgical Medical Binocular Loupe Dentist Head Lamp Gold'], 'ratings': [5.0, 3.0, 5.0, 2.0, 5.0, 5.0, 5.0, 5.0, 5.0, 3.0]}","{'items': ['Yes4All Multi Functional Camping Axe H307 with Saw + Fire Starter', 'Mil-Tec Multi-functional Headscarf', 'McNett Tactical Camo Form Protective Camouflage Wrap', 'Rothco Gi Style Pilots Survival Knife', ""Primos Gunhunter's Vest"", 'Duracoat Aerosol Kit Gloss Black', 'McNett Tactical Camo Form Protective Camouflage Wrap', 'MTM ACC223 Ammo Can Combo (Holds 400 Rounds)', 'MOLLE Waist Pack, MultiCam (OCP), NSN 8465-01-580-1300, USGI / RFI Issue', 'Grabber Outdoors The Original Space Brand Emergency Tactical-Survival Blanket- Olive-Drab/Silver (Pack of 3)'], 'ratings': [5.0, 4.0, 5.0, 4.0, 4.0, 5.0, 5.0, 5.0, 5.0, 5.0]}","{'items': ['Shooting Targets Gun Range Pasters Fluorescent Red 3 Inch Circle 100 Total Adhesive Stickers', 'Condor Outdoor MA52 Triple Pistol Mag Pouch, Tan', '18&quot; x 10&quot; Silhouette Splatter Target - Multi-Color -GlowShot Targets - See Your Hits Instantly', 'PARACORD PLANET Type III 7 Strand 550 Paracord', 'Grace Tools - Hook and Pick Set - 6-Piece Set - HP6- Gunsmith Tools and Accessories', 'Field Sport AR15 .223 Thread Protector, 1/2x28 Pitch.750', 'Ade Advanced Optics Front/Rear 45-Degree Rapid Transition BUIS Backup Iron Sight', 'Mossy Oak Stillwater Shotgun Case (Green with Black Trim, 52-Inch)', ' Magpul USGI 223 Ranger Plate Floorplate Loop (Pack of 3), Black ', 'Condor Single Rifle Case'], 'ratings': [4.0, 5.0, 5.0, 5.0, 5.0, 5.0, 4.0, 5.0, 5.0, 5.0]}","{'items': ['Mighty Deer Lick 4 lb. Sweet Apple Block', 'LEE PRECISION 7-mm/08 Pacesetter Dies', 'Hornady 50090 Kinetic Bullet Puller', 'Buck Bomb Doe in Estrus', 'NcStar 1&quot; High Ring with Weaver (RB13)', 'Pachmayr Decelerator Slip On Recoil Pad', 'Primos Hunting 6018 Folding Saw', 'Pachmayr Decelerator Slip On Recoil Pad', 'Primos Hunting 6018 Folding Saw', 'Lee Precision Pin/90783 Universal Decapping'], 'ratings': [4.0, 5.0, 4.0, 5.0, 4.0, 5.0, 5.0, 5.0, 5.0, 4.0]}"
821a8d67b3db8879d17b49830f044cf6,sports_and_outdoors,eval,amazon_sports_and_outdoors,https://cseweb.ucsd.edu/~jmcauley/datasets/amazon_v2/,"{'items': [' Ventura Super Loud Bicycle Tire Bell ', 'Serfas Drifter Tire with FPS', 'FSA A-Drive 175mm 28-38- 48 Square Taper Crankset', 'Jagwire Slick Galvanized Derailleur Wire 3100mm Shimano Head', 'Sunlite Rechargeable 3 LED Headlight with AM/FM Radio !', 'Origin 8 Compe-Lite Alloy Seat Post 27.2 with Clamp - Blue.', 'Mirrycle Road STI Bicycle Mirror - Only Compatible w/ 2010 or older', ' Mueller Stickum&ordf; Paste, 4 oz Jar - Each - Improves ball handling', ' Mueller Stickum&ordf; Paste, 4 oz Jar - Each - Improves ball handling', 'CAT EYE Rapid 5 Tail Light'], 'ratings': [2.0, 2.0, 4.0, 4.0, 1.0, 4.0, 1.0, 3.0, 3.0, 5.0]}","{'items': ['MAXXON wireless brake light', 'Hornit dB140 Bike Horn and LITE Headlight for Cyclists', 'Basil Basket Rain Cover 50005 Cento Black', 'Spec.-Ops. Brand T.H.E. Wallet', 'Avid Juicy/BB7 Disc Brake Pads', 'Park Tool Rotor Truing Fork - DT-2C', 'Maxpedition Remora Gearslinger', 'Maxpedition Remora Gearslinger', 'RumbleRoller Deep-Tissue Massage Roller, Blue, 31-Inch', 'Basil Cento Rear Basket, Black'], 'ratings': [2.0, 3.0, 2.0, 5.0, 5.0, 5.0, 3.0, 3.0, 5.0, 4.0]}","{'items': ['GoFit 40 ft. Combat Rope', 'Augusta Sportswear Mens Wicking Mock Turtleneck', ""Truform Compression Socks, 20-30 mmHg, Men's Dress Socks, Thigh High Over Knee Length, Black, Small"", 'Park Tool Spoke Tension Meter - TM-1', 'Park Tool Repair Stand Tray', 'Suddora Wrist Sweatband Also Available in Neon Colors - Athletic Cotton Terry Cloth Wristband for Sports(1 Piece)', 'Park Tool Portable Workbench - PB-1', 'Inline Handlebar Shim, Silver', 'Park Tool Supergrip Carbon and Alloy Assembly Compound - 4 oz. tube', 'RockShox Suspension Oil 15wt 120ml Bottle'], 'ratings': [1.0, 1.0, 4.0, 5.0, 1.0, 3.0, 3.0, 4.0, 4.0, 3.0]}","{'items': ['RockShox Seal (revive) kit, SID,Judy,Pilot,Dart (28mm)', 'SHIMANO XT/LX 9sp chainring, 104BCD x 32t - sil', 'Aero Tech Designs Neoprene Shoe Cover - Hi Viz and Black', 'Park Tool Rotor Truing Gauge - DT-3', 'SHIMANO Deore Front Bicycle Freehub - HB-T610-L', 'Alex DM18 26&quot; 32h Black Rim', 'Genuine Innovations G2132 Threaded CO2 Cartridge, 20 Gram (Pack of 6)', 'Portland Design Works Shiny Object CO2 Inflator Head', 'Grabber Outdoors Original Space Brand All Weather Blanket', 'Crystalcity-6662 Bicycle Bell Alloy mini'], 'ratings': [3.0, 4.0, 4.0, 4.0, 4.0, 3.0, 4.0, 4.0, 3.0, 4.0]}","{'items': ['SHIMANO Cleat Cover', 'ARSUXEO Outdoor Sports MTB Cycling Shorts', 'New Reflective Cap Safety Hat Neon Running Biker Hunte', 'Ritchey Tom Slick Pro K tire, 26 x 1.0', 'Bicycle Spoke Wraps (20&quot;, Red)', 'Shimano Road Brake Pads', 'Shimano Road Brake Pads', 'ACTION Speedometer 20&quot; with Reversible Drive', 'CatEye Rear Rack Bracket', 'Park Tool USA Professional Chain Tool CT-3, 10-Speed Compatible'], 'ratings': [4.0, 4.0, 5.0, 3.0, 3.0, 4.0, 4.0, 3.0, 4.0, 4.0]}"
941e71578b6a61ab4497bb35e635c938,sports_and_outdoors,eval,amazon_sports_and_outdoors,https://cseweb.ucsd.edu/~jmcauley/datasets/amazon_v2/,"{'items': [""Kwik Tek Large Hull Hugger Boat Fender (9' x 26)"", 'Moeller Flushrite Boat Motor Flusher (Dual Water Feed, Universal, Rectangular Cup)', 'Malone Clipper Deluxe Universal Kayak Cart', 'Wildgame Innovations Digital Directional Power Control Unit', 'Wildgame Innovations Digital Directional Power Control Unit', ' Stoneman Sports Kayak Extension Cradle for KC-322 or KC-422', 'YETI Tundra 50 Cooler', 'HD Harley-Davidson 15-Ounce Eagle Soars Mug', 'Galco UWKHMED Underwraps Belly Band (Khaki, Ambi)', 'Tramontina TT1018 Machete Wood Sword'], 'ratings': [1.0, 2.0, 3.0, 4.0, 4.0, 4.0, 5.0, 5.0, 4.0, 4.0]}","{'items': ['Under Armour Dynasty HeatGear Vented Compression Running Shorts', 'Justin Ladies Gypsy Steel 8in Work Boots', 'Harley Davidson Woven Golf Towel', 'Caldwell The Stable Table Carry Bag', 'VISM by NcStar Tactical Shotgun Scabbard', 'Ivysport Cotton Short Sleeve Heather Grey T-Shirt with Classic Logo (Cornell - Heather Grey, Small)', 'Tipton Flip Top Gun Solvent Bottle (3-Pack)', 'Harken Hoister 7802B 4 Point Hoister System', 'Shoreline Marine Double Braided Nylon Dock Line', 'Invincible Marine 3-Inch Block Letter Kit'], 'ratings': [4.0, 4.0, 3.0, 5.0, 4.0, 3.0, 5.0, 5.0, 5.0, 5.0]}","{'items': ['Shoreline Marine Fender', 'attwood 6522SS7 Universal Marine Boat LED Docking Lights', 'SeaSense Soft Point Stainless Steel Cleat', ' 802893Q01 Fuel/Water Separating Filter Quicksilver/Mercury ', 'Coleman Marine Performance Cooler', 'BANDC Dual Cigarette Lighter Socket Power Outlet - 12v Marine Grade Heavy Duty Waterproof', 'BSN Heavy-Duty Mesh Equipment Bag', 'TMS 315 Lb Outboard Boat Motor Stand Carrier Cart Dolly Storage Pro Heavy Duty New', 'BSN Heavy-Duty Mesh Equipment Bag', 'Morakniv Companion Fixed Blade Outdoor Knife with Sandvik Stainless Steel Blade, 4.1-Inch'], 'ratings': [4.0, 3.0, 4.0, 5.0, 2.0, 5.0, 4.0, 3.0, 4.0, 2.0]}","{'items': ['Quicksilver 16248 In-line Fuel Filter - Mercury and Mariner 2-Cycle and 4-Stroke Outboards', 'Quick Draw RH/LH Bowfishing Rest', 'Tektro Sabre BX2 BMX Linear Pull Brk Lvr Blk', 'Winter Warm Knit Thug Life Beanie Hat for Men and Women Winter Cap Skully Letter Beanie', 'Quicksilver 16248 In-line Fuel Filter - Mercury and Mariner 2-Cycle and 4-Stroke Outboards', 'PARACORD PLANET Type III 7 Strand 550 Paracord', 'L&amp;M Tactical 8&quot; Assisted Opening Knife 440 Stainless Steel', 'Berkley Connector Sleeve Size 4 Tackle, 0.080&quot; Diameter, 60-80 lbs Breaking Strength, Black, Per 25', 'Speedy Stitcher Kit', 'Muzzy 1080 Bowfishing Fish Hook Rest'], 'ratings': [4.0, 4.0, 5.0, 5.0, 4.0, 5.0, 4.0, 4.0, 4.0, 2.0]}","{'items': ['Igloo Marine Ultra Cooler', 'Shakespeare Two-Piece Medium Action Ladyfish Bigwater Combo 7-Feet', 'Precision Shooting Equipment Discovery Bowfishing Bow', 'Allen Company Molded Rubber Arrow Puller', 'Plano Protector Compact Bow Case (Black)', 'Aftco Fish Bat FBAT2B', 'October Mountain Products Arrow Guard W/12 Arrow Holder 25-47&quot;', 'Allen 674 Archery Bow String Wax', 'P-Line Deluxe Carbon Steel Hand Crimper', 'Genesis Pro Righthand Bow Black'], 'ratings': [3.0, 1.0, 4.0, 4.0, 4.0, 4.0, 4.0, 3.0, 3.0, 5.0]}"
4fac6e832912a9c10525c1136cfee49c,sports_and_outdoors,eval,amazon_sports_and_outdoors,https://cseweb.ucsd.edu/~jmcauley/datasets/amazon_v2/,"{'items': ['Coleman Oversized Quad Chair with Cooler, Blue', 'DRY PAK DP-46F Flip Phone Waterproof Case (4-Inch x 6-Inch)', 'SealLine Baja Dry Bag 20', 'Valeo Burst Resistant 65cm Body Ball (Pink)', 'Valeo Burst Resistant 65cm Body Ball (Pink)', 'New Balance Unisex Nanotex Wicking Cotton Crew 4-Pack Sock', 'Sabre Red Key Case Pepper Spray with Quick Release Key Ring - Police Strength - 25 Bursts &amp; 10-Foot (3m) Range with Practice Spray Option', 'Sabre Red Key Case Pepper Spray with Quick Release Key Ring - Police Strength - 25 Bursts &amp; 10-Foot (3m) Range with Practice Spray Option', 'Thermos Stainless King 16-Ounce Travel Tumbler, Cranberry', 'Rapala Combo Pack  6 1/2 Pliers / Jig Buster / Hook Sharpener / Clipper'], 'ratings': [5.0, 5.0, 5.0, 5.0, 5.0, 5.0, 5.0, 5.0, 5.0, 5.0]}","{'items': [' Altus Athletic 65cm 600-Pound Body Ball with DVD (Pearl)', 'FG502 Instant Mold and Mildew Stain Remover, Trigger Spray', 'Thermos 18-Ounce Stainless-Steel Hydration Bottle, Charcoal', 'St. Pierre American Professional Series Horseshoes Complete Set: Includes 4 Horseshoes, 24-inch Solid Steel Stakes, Official Rulebook, and Black Plastic Tote', 'TheraBand FlexBar, Tennis Elbow Therapy Bar, Relieve Tendonitis Pain &amp; Improve Grip Strength, Resistance Bar for Golfers Elbow &amp; Tendinitis', 'Nalgene Tritan Wide Mouth BPA-Free Water Bottle', 'The Original Stretch Out Strap with Exercise Book by OPTP &ndash; Top Choice of Physical Therapists &amp; Athletic Trainers', 'Grabber Toe Warmers 8-Pack 2014', 'Hikker BT409 Anti-shock Hiking Pole, 2-pack, Anti Shock Hiking / Walking / Trekking Trail Poles - 1 Pair With Compass &amp; Thermometer with 9-LED Flashlight With Battery Included', 'Schwinn 450 Elliptical Trainer'], 'ratings': [1.0, 5.0, 5.0, 4.0, 5.0, 5.0, 5.0, 5.0, 5.0, 5.0]}","{'items': ['Kijaro Dual Lock Folding Chair (XX-Large)', ""ProSource Therapy Flat Resistance Bands Set of 3 (6' each-Extra Long) for Stretching, Pilates, and Rehabilitation with Door Anchor"", 'j/fit Extra Firm Foam Roller - High Density Supreme Roller for Muscle Therapy &amp; Deep Tissue Massage - Myofascial Stress Release', 'Eureka! Bitterroot -Tent (sleeps 5-6)', 'NBA Los Angeles Clippers Primary Logo T-Shirt', 'Dcolor Gray Canopy 8 Metal Ribs Umbrella Headwear Hat for Fishing', 'Nalgene Tritan 24oz On the Fly (OTF) BPA-Free Water Bottle', 'SKLZ Basketball Shooting Target', 'JOOLA Expert Table Tennis Tour Case with Two Rossi Smash Rackets', 'UnderArmour Heat Gear 4 Pair Pack Crew Socks'], 'ratings': [5.0, 5.0, 5.0, 5.0, 4.0, 2.0, 5.0, 4.0, 5.0, 2.0]}","{'items': ['UnderArmour Heat Gear 4 Pair Pack Crew Socks', 'Falcon Marine Signal Horn.', 'Chicago Metallic 8044 Non-Stick 4-Piece Toaster Oven Bakeware Set, Set of 1', 'New Wave Enviro Products Glass Bottle', 'Bushnell PowerSync SolarWrap Mini USB Charger', 'STIGA Flow Outdoor Table Tennis Racket', 'STIGA Pro Carbon Performance-Level Table Tennis Racket with Carbon Technology for Tournament Play', 'Bionic Body Resistance Tube', 'MONTANA DECOY Garden Kojo', 'Viva Sol Premium Backyard Washer Toss Game Includes 8 Washers with Built-In Bottle Openers'], 'ratings': [2.0, 5.0, 5.0, 4.0, 5.0, 4.0, 5.0, 4.0, 2.0, 5.0]}","{'items': ['Maxcraft Digital Tire Air Pressure Gauge Multi Purpose Auto Emergency 5-in-1 Tool 60301', 'Guard Dog Inferno Dual Spark Stun Gun Flashlight, MAX Volts, Ultra Bright LED Bulb, Rechargeable', 'Viva Sol Premium Horseshoes Outdoor Game Set with 4 Horseshoes, 2 Stakes, and Wooden Case', 'Baby Bottle Warmer, Bottle Sterilizer &amp; Smart Thermostat 4-in-1 with Evenly Warming Breast Milk or Formula, Real-time Temperature LCD Monitor', 'Ringside Combat Sports MMA Kickboxing Shin Guards, Black, Large', 'DayOne Response Waterbag', 'Hydro Flask Vacuum Insulated Stainless Steel Water Bottle, Standard Mouth w/Loop Cap', 'Gaiam Sol Meditation Support Pillow (Ankle &amp; Knee)', '24oz Pocket Carrier for Hydro Flask Type Bottles with Adjustable Straps (Neoprene Sleeve/pouch)', 'SABRE Compact Sport &amp; Safety Horn &ndash;Audible to &frac12; Mile (805 M) &mdash; Personal Safety, Hiking, Boating, or Sporting Events'], 'ratings': [5.0, 4.0, 4.0, 4.0, 4.0, 4.0, 4.0, 4.0, 4.0, 4.0]}"
bfbcfeacff3901d2d841e911604c9779,sports_and_outdoors,eval,amazon_sports_and_outdoors,https://cseweb.ucsd.edu/~jmcauley/datasets/amazon_v2/,"{'items': ['Cold Steel Recon Tanto Kraton Handle with Black Blade (Secure-Ex Sheath)', 'Spyderco C11PSBK Delica Lockback Knife, Black, 7.13-Inch', 'Rapala Countdown 1/4 Oz Fishing Lures', 'Berkley Gulp! Jigging Grub, 2in | 5cm, Soft Bait - 2in | 5cm', 'Organized Fishing Round Floor Rack for Fishing Rod Storage', 'Bass Pro Shops Larry Nixon Spring Tactics Video - DVD', 'Rothco Genuine U.S.N Wool Watch Cap', 'Power Pro Super 8 Slick Braided Fishing Line (Aqua Green)', 'Gamakatsu Circle Offset Point Octopus Hook-Pack Of 25 (Black)', 'Gamakatsu Circle Offset Point Octopus Hook-Pack Of 25 (Black)'], 'ratings': [5.0, 5.0, 5.0, 5.0, 5.0, 5.0, 3.0, 5.0, 5.0, 5.0]}","{'items': ['Daiwa Sealine SG-3B Freshwater/Saltwater Line Counter Reels', 'Spyderco 000968 Endura4 Lightweight Black FRN Spyderedge', 'Organized Fishing Round Floor Rack for Fishing Rod Storage', 'Shakespeare Two-Piece Medium Action Outback Baitcast Rod', 'OKUMA Classic Pro GLT', 'Greenfield Products 618-B Marine Black Coated Richter Anchor - 18 Pound Capacity', 'Scotty Baitcaster/Spinning Rod Holder Black with 244 Flush Deck Mount', 'Gamakatsu Black Octopus Hook, 100 Pack', 'Berkley SN306-81 Trilene Sensation Service Spool with 6-Pounds Test, Solar, 3000-Yards', 'Rapala Super Line Scissors'], 'ratings': [5.0, 5.0, 2.0, 5.0, 5.0, 5.0, 3.0, 5.0, 2.0, 2.0]}","{'items': ['Rothco R/S 8 PT Marine Cap', 'Gulp! Alive! Recharge Liquid', 'Frabill Leech Bag, Yellow', 'Spike-It Dip-N-Glow Lure Dye', 'Spike-It Dip-N-Glow Lure Dye', 'Spike-It Dip-N-Glow Lure Dye', 'Spike-It Dip-N-Glow Lure Dye', 'Garelick/Eez-In 71090:01 Aluminum Auxiliary Motor Bracket for 4 Stroke Motors', 'Garelick/Eez-In 71090:01 Aluminum Auxiliary Motor Bracket for 4 Stroke Motors', 'BEP 900-6WPW Splash Proof Panel - 6 way - White'], 'ratings': [5.0, 5.0, 5.0, 4.0, 4.0, 4.0, 4.0, 3.0, 3.0, 5.0]}","{'items': [' Wave Spin DHXL Fishing Reel ', 'Breakaway Rocket Fuel Oil', 'VMC Faultless Octopus Red Hooks - Size 2 or 4 - 100 Pack - #V9299TRM', 'Seaguar Abrazx 100% Fluorocarbon 1000 Yard Fishing Line', 'Mustad UltraPoint Slow Death Special Bend Aberdeen Hook', 'Spike-It Dip-N-Glow Lure Dye', 'Berkley Gulp Alive Floating Pinched Crawler Soft Bait, 1.7-Ounce, Nightcrawler', 'Shakespeare Excursion Casting Rod', 'Spike-It Dip-N-Glow Lure Dye', 'Mustad UltraPoint Slow Death Special Bend Aberdeen Hook'], 'ratings': [4.0, 5.0, 5.0, 5.0, 5.0, 5.0, 5.0, 5.0, 5.0, 5.0]}","{'items': ['Spike-It Dip-N-Glow Lure Dye', 'Spike-It Dip-N-Glow Lure Dye', 'DU-BRO Fishing Kwik-Mount Slip Bobber Weights', 'Lindy Riggers - Lindy Rigger Kit - 3 Per Box', 'Lindy Riggers - Lindy Rigger Kit - 3 Per Box', 'Bullet Weights Ultra Steel Bass Casting Sinkers', 'Gamakatsu Octopus Circle Hook', 'Scotty #259 All Nylon Rod Holder Extender', 'EAGLE CLAW FISHING TACKLE CO. Lazer Sharp Crappie Aberdeen Rotating Hook, Red', 'Bass Assassin Bang Fish Attractant Aerosol'], 'ratings': [5.0, 5.0, 5.0, 5.0, 5.0, 3.0, 5.0, 5.0, 1.0, 5.0]}"
6a7fc15b7faaaf9e20f3d5c9ee214e78,sports_and_outdoors,eval,amazon_sports_and_outdoors,https://cseweb.ucsd.edu/~jmcauley/datasets/amazon_v2/,"{'items': ['Spyderco Tenacious Plain Edge Folding Knife, Black/Silver', 'Kershaw 1670DSBLK Desert Sand/Black Blur Knife with SpeedSafe', 'Simmons Truplex Riflescope (3-9X40, Matte)', 'KA4062CB-BRK Dozier Folding Hunter', 'Frankford Arsenal Quick-N-EZ Impact Bullet Puller for Reloading', 'Spyderco Tern Slipit G-10 Plain Edge Knife, Black', 'Smith &amp; Wesson M&amp;P Black Serrated Knife Desert Camo Handle 701483', 'SOG Specialty Knives &amp; Tools SP23-CP Sogzilla Knife with Straight Edge Folding 3.8-Inch Steel Clip Point Blade with GRN Handle, Hardcase Black Finish', ""UTG Shooter's SWAT Bipod, Rubber Feet, Height 6.2&quot;-6.7&quot;"", 'Electric Shock 3.8 Million Volt Tactical Security Stun Gun Pink'], 'ratings': [5.0, 5.0, 4.0, 4.0, 4.0, 4.0, 3.0, 4.0, 3.0, 4.0]}","{'items': ['Boker Magnum Compact Rescue Knife', ' MTech USA MT-113 Rescue Team Fixed Blade Survival Knife, Black Straight Edge Tanto Blade, Black Handle, 10-1/2-Inch Overall ', 'Condor Compact Assault Pack (small)', 'KA-BAR 1258 Short USA Clip Point Knife-Hard Sheath', 'Spyderco Byrd Robin2 Lightweight PlainEdge', 'KA4062BO-BRK Dozier Folding Hunter', 'Kershaw Leek, Orange Pocket Knife (1660OR), 3&rdquo; Bead-Blasted High-Performance Sandvik 14C28N Steel Blade, Orange Anodized Aluminum Handle, SpeedSafe Assisted Opening, Liner and Tip Lock Slider; 2.4 OZ', 'Spyderco C66PBK3 Centofante III Knife', 'Kershaw Echelon 1880 Pocket Knife', 'Magnum Exchange Pocket Knife, Olive Drab'], 'ratings': [5.0, 4.0, 4.0, 5.0, 4.0, 4.0, 5.0, 3.0, 3.0, 3.0]}","{'items': ['Spyderco ParaMilitary2 Camo G-10 PlainEdge Knife', 'Bulldog Case Belly Band Holster', 'Bulldog Case Belly Band Holster', 'Victorinox Swiss Army Hunter XT Knife with Pouch, 111mm, Orange', 'Spyderco Delica Folding Knife - Choose Style', 'Spyderco Inc. 9000685 Delica 4 Folding Knife, Zome Green', 'Spyderco Delica Folding Knife - Choose Style', 'Monstrum Tactical 200 Lumens LED Flashlight with Remote Pressure Switch, Colored Lens Filters, and Rail Mount', 'Benchmade - Mini Griptilian 555HG Knife, Plain Sheepsfoot', 'LEE PRECISION LA II Primer Feed'], 'ratings': [5.0, 4.0, 4.0, 4.0, 5.0, 5.0, 5.0, 4.0, 3.0, 3.0]}","{'items': ['UTG Elite Tactical Leg Holster (Left Handed)', 'LEE PRECISION LA II Primer Feed', 'GREY 50% WOOL RESCUE BLANKET', 'Open Country Backpacker II Two Person Cook Set', 'Army Universe Nylon Military Paracord 550 lbs Type III 7 Strand Utility Cord Rope USA Made', ""Hoppe's No. 9 Lubricating Oil, 2-1/4 oz. Bottle"", 'Full Body Honeycomb Mesh Sniper Veil Cover 60&quot; x 96&quot; (Woodland Camouflage)', 'Civilian MRE Gift Set', '3 Bug Slipit Set SS Plain Edge', 'Magpul PTS MBUS Front &amp; Rear Back-UP Sight Set Black'], 'ratings': [4.0, 3.0, 4.0, 4.0, 4.0, 4.0, 3.0, 5.0, 4.0, 3.0]}","{'items': ['Surplus Nation 300 FT. Nylon Paracord 7 Strand 550 Type III Commercial Grade', 'Command Arms AR15/M16 Stock Saddle (fits collapsible stocks)', 'LEE PRECISION 90667, Pro 1000, Load-Master Progressive Press, Case Collator', 'RSR Group, Inc DeSantis S and W Shield Sof-Tuck Holster', 'LEE PRECISION 90667, Pro 1000, Load-Master Progressive Press, Case Collator', ' LEE PRECISION 90792, Auto Disk, Adjustable Powder Charge bar, black ', ' LEE PRECISION 90792, Auto Disk, Adjustable Powder Charge bar, black ', 'Plano 131252 Dry Storage Emergency Marine Box, Orange', 'Mueller APV AO Rifle Scope, Black, 4.5-14 x 40mm', 'Weaver Base System'], 'ratings': [4.0, 2.0, 5.0, 5.0, 5.0, 4.0, 4.0, 4.0, 3.0, 5.0]}"
9f0de4261f9662a25a0da89740fc17a1,sports_and_outdoors,eval,amazon_sports_and_outdoors,https://cseweb.ucsd.edu/~jmcauley/datasets/amazon_v2/,"{'items': ['Defender Belly Band Holster for Concealed Carry Elastic Waist Band Handgun Carrying System Elastic gun Holder for Pistols Revolvers for Men and Women IWB Holster with Free Mag Holder Made in USA', 'Voodoo Tactical Cap w/ Removable USA Flag Velcro Patch', 'Jtech Gear Jar Head Assault Backpack', '75 Lb. V-Force Short Weight Vest - Made in USA', 'Kryptek Helmet Logo Typhon Camo Cap', ""104-001 Apex Tactical Specialties, Armorer's Block, for Gunsmiths, Polymer, Red"", 'Sub Sports Mens Graduated Compression Short Sleeve Top Vest Running Recovery', 'Sub Sports Elite RX Mens Graduated Compression Base Layer Tights/Pants', 'Mossy Oak Bow String Wax', 'Chicago Bulls Black Primary Logo Long Sleeve T-Shirt'], 'ratings': [5.0, 4.0, 5.0, 5.0, 4.0, 5.0, 5.0, 5.0, 4.0, 5.0]}","{'items': ['Splatterburst Targets - 12 x18 inch - Silhouette Reactive Shooting Target - Shots Burst Bright Fluorescent Yellow Upon Impact - Gun - Rifle - Pistol - Airsoft - BB Gun - Air Rifle', 'Sandpiper of California Tactical Leaders Arm Band', 'UTG Heavy Duty Push Button QD Sling Swivel, 1.38&quot; Loop', 'WinCraft NFL Mens Fiber Reactive Beach Towel', 'AimPoint Micro T-1 4 MOA Night Vision Compatible Sight', 'Sling Shot Original', ' Sub Sports Mens Compression Leggings Tights Running Layer Sweat Wicking Fabric', 'Sub Sports Mens Long Sleeve Compression Top Base Layer Crew Neck Vest', 'Yukon Outfitters Rifle Scabbard, Olive Drab', 'BLACKHAWK! SERPA Quick Disconnect Kit (2 Female/1 Male)'], 'ratings': [5.0, 5.0, 5.0, 4.0, 4.0, 4.0, 4.0, 4.0, 4.0, 5.0]}","{'items': ['T.R.U. Ball Predator Bow Release Buckle Wrist Strap Black', ""Sportsman's Outdoor Products Tarantula Sleeve Wrap Armguard (Camo)"", 'Krav Maga Shorts, Bad Things', 'Serpa Strike Platform, Ambi. w/Speed Clips, Coyote Tan', 'TRAININGMASK Elevation Training Mask 2.0&quot;Bane Sleeve Only - Small', 'FrogLube CLP Liquid OR Spray 4 oz Bottle  (PACKAGE MAY VARY)', 'Condor Hydration Bladder Olive Drab', ""Arc'teryx Big A Cap"", ""Chicago Bears 'B' Franchise Fitted Hat by '47 Brand Select Franchise Hat Size: Large - 7 3/8 to 7 1/2"", 'Seahorse SE-300 Handgun Case'], 'ratings': [4.0, 4.0, 4.0, 4.0, 5.0, 5.0, 4.0, 4.0, 4.0, 4.0]}","{'items': ['Galco Combat Master Belt Holster for 1911 5-Inch Colt, Kimber, Para, Springfield', 'Galco Combat Master Belt Holster for 1911 5-Inch Colt, Kimber, Para, Springfield', 'Cold Steel Bokken Polypropylene Handle', ""Chicago Bulls Adidas Originals NBA &quot;Ring It Up&quot; Men's T-Shirt"", 'Hostage Series - 19&quot; x 24&quot; 10 Pack', '1Pk. Baseball Caps Insert| Hat Shaper Washing Aide| Long Lasting Liner| Ball Caps Form Shaper| Brim Hat Crown Stretcher| Hat Support| Hat Storage Aide 100% MBG, BUT WAIT! Buy 5 or more get FREE S&amp;H.', 'VZ Grips Operator II Gun Grip', 'Panteao Productions Make Ready with Travis Haley: Adaptive Handgun', 'U.S. Tactical Sewing USTS Advanced Modular Headset Cover', 'Men Military Airsoft Hunting Pants Combat Gen2 Tactical Pants with Knee Pads Coyote Brown'], 'ratings': [4.0, 4.0, 4.0, 5.0, 4.0, 4.0, 5.0, 4.0, 4.0, 4.0]}","{'items': [""VF NHL Men's Goal Crease Long Sleeve Shirt"", 'Blade Tech Industries Molle Lok Gen 3 Attachment Small Holster with Hardware, Black', '(30) AT-27 Paper Shooting Targets Silhouette 23&quot;x35&quot; MADE IN USA', 'Streamlight 69260 TLR-1 HL Weapon Mount Tactical Flashlight Light 800 Lumens with Strobe - 800 Lumens', ""Panteao Productions: Make Ready with Dean Caputo 1911 Armorer's Bench - PMR003 - 1911 Diganostics - Armorer Training - Law enforcement - Gun Repair - DVD"", ""The M1911 Complete Owner's Guide"", 'Elite CO Shooters Belt with Cobra Buckle, 1.5&quot;', 'Knights Armament Company Kac 600M Micro Flip Rear Sight Blk', 'FireClean Fouling-Resistant Oil 2 Ounce FC-2', 'The U.S. M1911/M1911A1 Pistols and Commercial M1911 Type Pistols: A Shop Manual'], 'ratings': [4.0, 4.0, 4.0, 5.0, 4.0, 4.0, 4.0, 4.0, 4.0, 4.0]}"
